tool_name,server_name,mcp_server_slug,type,tool_type,service_type,is_mcp_server,action,vendor,category,description,env_keys,has_existing_mcp,source_code_link,documentation_url
DNSDumpster,(none),dnsdumpster-mcp,langchain_tool,Open Source,langchain_tool,no,ALREADY_BUILT,Hackerdogs,OSS,"DNS mapping via DNSDumpster. This tool queries DNSDumpster to retrieve DNS records, subdomains, and network mapping information for a given domain. Use for DNS reconnaissance, subdomain discovery, and",,yes,https://dnsdumpster.com,https://dnsdumpster.com
Holehe,(none),holehe-mcp,langchain_tool,Open Source,langchain_tool,no,ALREADY_BUILT,Hackerdogs,OSS,Check email registration on 120+ sites using Holehe tool. This tool verifies if an email address is registered on various websites and services by attempting to create accounts or checking account exi,,yes,https://github.com/megadose/holehe,https://github.com/megadose/holehe
Julius MCP Server,julius-mcp,julius-mcp,docker,Risk Assessment Tool,mcp_server,yes,ALREADY_BUILT,https://github.com/praetorian-inc/julius,OSS,"Julius fingerprints 33+ LLM services running on network endpoints. It sends crafted HTTP probes and matches response signatures to identify the exact server infrastructure — Ollama, vLLM, LiteLLM, Hug",,yes,https://github.com/praetorian-inc/julius,https://github.com/hackerdogs-ai/hd-mcpservers-docker/tree/main/julius-mcp
Maigret,(none),maigret-mcp,langchain_tool,Open Source,langchain_tool,no,ALREADY_BUILT,Hackerdogs,OSS,"Advanced username search with metadata extraction across 3000+ sites using Maigret. This tool collects a dossier on a person by username only, checking for accounts on a huge number of sites and gathe",,yes,https://github.com/soxoj/maigret,https://github.com/soxoj/maigret
OnionSearch,(none),onionsearch-mcp,langchain_tool,Open Source,langchain_tool,no,ALREADY_BUILT,Hackerdogs,OSS,Scrape Dark Web search engines using OnionSearch tool. This tool searches across multiple .onion search engines to find URLs and content on the Dark Web. A specialized dark web reconnaissance tool tha,TOR_PROXY,yes,https://github.com/megadose/OnionSearch,https://github.com/megadose/OnionSearch
Semgrep MCP SERVER,semgrep,semgrep-mcp,docker,OSINT Tool,mcp_server,yes,ALREADY_BUILT,https://github.com/semgrep/semgrep/tree/develop/cli/src/semgrep/mcp#tools,OSS,"A specialized code security server that brings Static Application Security Testing (SAST) directly into the AI development loop. It allows LLMs to scan code for vulnerabilities, secrets, and supply ch",,yes,https://github.com/semgrep/semgrep/tree/develop/cli/src/semgrep/mcp#tools,https://github.com/semgrep/semgrep/tree/develop/cli/src/semgrep/mcp#tools
Sherlock,(none),sherlock-mcp,langchain_tool,Open Source,langchain_tool,no,ALREADY_BUILT,Hackerdogs,OSS,"A specialized OSINT reconnaissance tool designed for username enumeration across 300+ social networks, forums, and websites. It uses asynchronous requests to quickly check for the existence of an acco",,yes,https://github.com/sherlock-project/sherlock,https://github.com/sherlock-project/sherlock
Subfinder,(none),subfinder-mcp,langchain_tool,Open Source,langchain_tool,no,ALREADY_BUILT,ProjectDiscovery,OSS,Enumerate subdomains using Subfinder (fast passive discovery). Subfinder is extremely fast for passive subdomain discovery using multiple passive sources. Use this for quick subdomain enumeration when,,yes,https://github.com/projectdiscovery/subfinder,https://docs.projectdiscovery.io/opensource/subfinder/install
VirusTotal MCP,virustotal,virustotal-mcp,npx,OSINT Tool,mcp_server,yes,ALREADY_BUILT,BurtTheCoder,OSS,"A Model Context Protocol (MCP) server that connects AI assistants to the VirusTotal API for comprehensive security analysis. It allows agents to retrieve detailed reports on URLs, files, IPs, and doma",,yes,https://github.com/BurtTheCoder/mcp-virustotal,https://github.com/BurtTheCoder/mcp-virustotal
ZMap,(none),zmap-mcp,langchain_tool,Open Source,langchain_tool,no,ALREADY_BUILT,Hackerdogs,OSS,Single-packet scanning using ZMap. ZMap is a fast single-packet network scanner designed for Internet-wide network surveys. It can perform a complete scan of the IPv4 address space in under 45 minutes,,yes,https://github.com/zmap/zmap,https://github.com/zmap/zmap
AbstractAPI Company Enrichment,(none),abstractapi-company-enrichment-mcp,langchain_tool,API,langchain_tool,no,BUILD_NEW_MCP,Hackerdogs,API,Company enrichment via AbstractAPI. Returns organization metadata for a domain. Company enrichment and firmographic data retrieval service via AbstractAPI. Inputs: Domain name or business email addres,COMPANY_ENRICHMENT_API_KEY,no,https://www.abstractapi.com/api/company-enrichment-api,https://www.abstractapi.com/
AbstractAPI Email Reputation,(none),abstractapi-email-reputation-mcp,langchain_tool,API,langchain_tool,no,BUILD_NEW_MCP,Hackerdogs,API,"Email reputation and deliverability checks via AbstractAPI.  A comprehensive email verification and deliverability tool. It performs real-time checks to determine if an email address is valid, active,",EMAIL_REPUTATION_API_KEY,no,https://www.abstractapi.com/api/email-verification-validation-api,https://www.abstractapi.com/
AbstractAPI Exchange Rates (Live),(none),abstractapi-exchange-rates-live-mcp,langchain_tool,API,langchain_tool,no,BUILD_NEW_MCP,Hackerdogs,API,Live exchange rates via AbstractAPI. Returns base currency and exchange_rates map.  Provides real-time and historical global currency conversion data. It returns the base currency and a mapped object ,EXCHANGE_RATES_API_KEY,no,https://www.abstractapi.com/api/exchange-rate-api,https://www.abstractapi.com/
AbstractAPI Holidays,(none),abstractapi-holidays-mcp,langchain_tool,API,langchain_tool,no,BUILD_NEW_MCP,Hackerdogs,API,"Holiday lookup via AbstractAPI. Returns holiday objects for a country and date.  A global holiday lookup service that identifies public, bank, and religious holidays for specific countries and dates. ",HOLIDAYS_API_KEY,no,https://www.abstractapi.com/api/holidays-api,https://www.abstractapi.com/
AbstractAPI IBAN Validation,(none),abstractapi-iban-validation-mcp,langchain_tool,API,langchain_tool,no,BUILD_NEW_MCP,Hackerdogs,API,IBAN validation via AbstractAPI. Validates IBAN and returns validity details.  Validates International Bank Account Numbers (IBAN) for accuracy and authenticity. It checks the mathematical checksum an,IBAN_VALIDATION_API_KEY,no,https://www.abstractapi.com/api/iban-validation-api,https://www.abstractapi.com/
AbstractAPI IP Intelligence,(none),abstractapi-ip-intelligence-mcp,langchain_tool,API,langchain_tool,no,BUILD_NEW_MCP,Hackerdogs,API,"IP intelligence via AbstractAPI. Returns geo/ASN/security signals for an IP.  Provides deep insights into IPv4 and IPv6 addresses. It returns geolocation (city, country, coordinates), ASN data (Intern",IP_INTELLIGENCE_API_KEY,no,https://www.abstractapi.com/api/ip-geolocation-api,https://www.abstractapi.com/
AbstractAPI Phone Intelligence,(none),abstractapi-phone-intelligence-mcp,langchain_tool,API,langchain_tool,no,BUILD_NEW_MCP,Hackerdogs,API,Phone intelligence enrichment via AbstractAPI. Validates/parses phone numbers and returns carrier/line type/country metadata.  An enrichment tool for global phone numbers. It validates the number's fo,PHONE_INTELLIGENCE_API_KEY,no,https://www.abstractapi.com/api/phone-validation-verification-api,https://www.abstractapi.com/
AbstractAPI Timezone (Current Time),(none),abstractapi-timezone-current-time-mcp,langchain_tool,API,langchain_tool,no,BUILD_NEW_MCP,Hackerdogs,API,Timezone current time lookup via AbstractAPI. Returns timezone_name and datetime for a location.  Returns the current local time and detailed timezone information for a specific location or coordinate,TIMEZONE_API_KEY,no,https://www.abstractapi.com/api/timezone-api,https://www.abstractapi.com/
AbstractAPI VAT Validation,(none),abstractapi-vat-validation-mcp,langchain_tool,API,langchain_tool,no,BUILD_NEW_MCP,Hackerdogs,API,"VAT validation via AbstractAPI. Validates VAT number and returns company/country details.  Validates Value Added Tax (VAT) identification numbers, primarily for European and international trade. It co",VAT_API_KEY,no,https://www.abstractapi.com/api/vat-validation-api,https://www.abstractapi.com/
AbuseCH Domain Report,(none),abusech-domain-report-mcp,langchain_tool,Open Source,langchain_tool,no,BUILD_NEW_MCP,abuse.ch,OSS,"Get a comprehensive domain report from abuse.ch platforms via a unified API layer (URLhaus host intelligence + ThreatFox IOC intelligence). Use this to assess suspicious domains, identify related mali",ABUSECH_API_KEY,no,https://abuse.ch/,https://abuse.ch/
AbuseCH File Report,(none),abusech-file-report-mcp,langchain_tool,Open Source,langchain_tool,no,BUILD_NEW_MCP,abuse.ch,OSS,"Get a comprehensive file/hash report from abuse.ch platforms via a unified API layer (MalwareBazaar + URLhaus payload + ThreatFox). Use this to enrich file hashes (MD5/SHA1/SHA256), retrieve malware f",ABUSECH_API_KEY,no,https://abuse.ch/,https://abuse.ch/
AbuseCH IP Report,(none),abusech-ip-report-mcp,langchain_tool,Open Source,langchain_tool,no,BUILD_NEW_MCP,abuse.ch,OSS,Get a comprehensive IP report from abuse.ch platforms via a unified API layer (URLhaus host intelligence + ThreatFox IOC intelligence). Use this to enrich suspicious IPs from logs/alerts and correlate,ABUSECH_API_KEY,no,https://abuse.ch/,https://abuse.ch/
AbuseCH URL Report,(none),abusech-url-report-mcp,langchain_tool,Open Source,langchain_tool,no,BUILD_NEW_MCP,abuse.ch,OSS,"Get a comprehensive URL report from abuse.ch platforms via a unified API layer (URLhaus URL intelligence). Use this to analyze suspicious URLs, retrieve URL status/threat classification, tags, and rel",ABUSECH_API_KEY,no,https://abuse.ch/,https://abuse.ch/
Alien Vault Domain Report,(none),alien-vault-domain-report-mcp,langchain_tool,Threat Intelligence Platform,langchain_tool,no,BUILD_NEW_MCP,AlienVault (Tool created by Hackerdogs),OSS,Retrieves a comprehensive threat intelligence report for a specific domain from the AlienVault Open Threat Exchange (OTX). It identifies malicious pulses (threat actor reports) that mention the domain,API_KEY,no,,
Alien Vault File Report,(none),alien-vault-file-report-mcp,langchain_tool,Threat Intelligence Platform,langchain_tool,no,BUILD_NEW_MCP,AlienVault (Tool created by Hackerdogs),OSS,"Fetches deep analysis for a specific file hash (MD5, SHA1, or SHA256) from the OTX database. It returns threat signatures, malware family classifications, and YARA rule matches. The report provides a ",API_KEY,no,,
Alien Vault IP Report,(none),alien-vault-ip-report-mcp,langchain_tool,Threat Intelligence Platform,langchain_tool,no,BUILD_NEW_MCP,AlienVault (Tool created by Hackerdogs),OSS,"Provides an IP reputation and intelligence report from AlienVault OTX. It includes the IP's Autonomous System Number (ASN), geolocation details, and its history of involvement in malicious activity. T",API_KEY,no,,
Alien Vault Url Report,(none),alien-vault-url-report-mcp,langchain_tool,Threat Intelligence Platform,langchain_tool,no,BUILD_NEW_MCP,AlienVault,OSS,"Get AlienVault OTX analysis report for a URL. This tool queries AlienVault OTX's threat intelligence database for URL analysis results. OTX aggregates IOCs from security researchers, making it valuabl",API_KEY,no,,
Baidu Search,(none),baidu-search-mcp,langchain_tool,Open Source,langchain_tool,no,BUILD_NEW_MCP,Hackerdogs,OSS,"Fetch Baidu search result pages and extract emails + hostnames for the target word/domain. Returns structured, LLM-friendly JSON.  An OSINT reconnaissance tool that scrapes Baidu search results to ext","BAIDU_TIMEOUT, BAIDU_USER_AGENT",no,,https://hackerdogs.ai
BeVigil,(none),bevigil-mcp,langchain_tool,Open Source,langchain_tool,no,BUILD_NEW_MCP,Hackerdogs,OSS,Perform OSINT (Open Source Intelligence) lookup for a domain using BeVigil API. Discovers subdomains and interesting URLs associated with a target domain. Queries BeVigil OSINT API endpoints to find a,"BEVIGIL_API_KEY, BEVIGIL_TIMEOUT",no,,https://hackerdogs.ai
Browserless,(none),browserless-mcp,langchain_tool,Web Search,langchain_tool,no,BUILD_NEW_MCP,Hackerdogs,OSS,"A suite of browser-as-a-service tools for advanced web interaction. It can extract raw HTML (/content), execute custom JavaScript (/function), generate high-fidelity PDFs (/pdf), scrape structured dat","BROWSERLESS_URL, BROWSERLESS_API_KEY",no,,
Browserless Content,(none),browserless-content-mcp,langchain_tool,Open Source,langchain_tool,no,BUILD_NEW_MCP,Hackerdogs,OSS,Extract content from web pages using Browserless /content endpoint. This tool fetches HTML content from a URL and returns it as text. Perfect for simple content extraction without JavaScript execution,"BROWSERLESS_URL, BROWSERLESS_API_KEY",no,https://github.com/browserless/chrome,https://docs.browserless.io/rest-apis/intro
Browserless Function,(none),browserless-function-mcp,langchain_tool,Open Source,langchain_tool,no,BUILD_NEW_MCP,Hackerdogs,OSS,Execute JavaScript functions on web pages using Browserless /function endpoint. This tool allows you to run custom JavaScript code on a page and return the result. Perfect for extracting dynamic conte,"BROWSERLESS_URL, BROWSERLESS_API_KEY",no,https://github.com/browserless/chrome,https://docs.browserless.io/rest-apis/intro
Browserless PDF,(none),browserless-pdf-mcp,langchain_tool,Open Source,langchain_tool,no,BUILD_NEW_MCP,Hackerdogs,OSS,"Generate PDFs from web pages using Browserless /pdf endpoint. This tool converts a web page to PDF format and returns it as base64-encoded data. Supports various PDF formats (A4, Letter, etc.).  A doc","BROWSERLESS_URL, BROWSERLESS_API_KEY",no,https://github.com/browserless/chrome,https://docs.browserless.io/rest-apis/intro
Browserless Scrape,(none),browserless-scrape-mcp,langchain_tool,Open Source,langchain_tool,no,BUILD_NEW_MCP,Hackerdogs,OSS,Scrape structured data from web pages using Browserless /scrape endpoint. This tool extracts structured data from web pages using CSS selectors and returns JSON data matching the specified selectors. ,"BROWSERLESS_URL, BROWSERLESS_API_KEY",no,https://github.com/browserless/chrome,https://docs.browserless.io/rest-apis/intro
Browserless Screenshot,(none),browserless-screenshot-mcp,langchain_tool,Open Source,langchain_tool,no,BUILD_NEW_MCP,Hackerdogs,OSS,Capture screenshots of web pages using Browserless /screenshot endpoint. This tool takes a screenshot of the specified URL and returns it as base64-encoded image. Supports full page screenshots.  A vi,"BROWSERLESS_URL, BROWSERLESS_API_KEY",no,https://github.com/browserless/chrome,https://docs.browserless.io/rest-apis/intro
Browserless Unblock,(none),browserless-unblock-mcp,langchain_tool,Open Source,langchain_tool,no,BUILD_NEW_MCP,Hackerdogs,OSS,Bypass bot detection and unblock websites using Browserless /unblock endpoint. This tool uses advanced techniques to bypass Cloudflare and other bot detection systems. Use this when regular scraping f,"BROWSERLESS_URL, BROWSERLESS_API_KEY",no,https://github.com/browserless/chrome,https://docs.browserless.io/rest-apis/intro
Certgraph (Certificate Graph) - JSON,(none),certgraph-certificate-graph-json-mcp,langchain_tool,Open Source,langchain_tool,no,BUILD_NEW_MCP,lanrat/certgraph,OSS,Build a certificate relationship graph for a host and return JSON output. Uses Dockerized certgraph. Best default driver is http (direct TLS fetch). Use crtsh driver when you want CT-based expansion (,"VISUALIZER, CENSYS_APPID, CENSYS_SECRET, CERTGRAPH_DEFAULT_DEPTH, CERTGRAPH_DEFAULT_DRIVER, CERTGRAPH_DOCKER_PLATFORM",no,https://github.com/lanrat/certgraph,https://github.com/lanrat/certgraph
Crawl4AI MCP Server,(none),crawl4ai-mcp-server-mcp,langchain_tool,Web Search,langchain_tool,no,BUILD_NEW_MCP,,OSS,"Advanced web crawling and content extraction using Crawl4AI API service. This tool provides intelligent web scraping with JavaScript execution, CSS selectors, structured extraction, LLM-based extracti","CRAWL4AI_URL, CRAWL4AI_API_TOKEN",no,,
ExifTool Metadata Extract,(none),exiftool-metadata-extract-mcp,langchain_tool,Open Source,langchain_tool,no,BUILD_NEW_MCP,Hackerdogs,OSS,"Extract metadata from images/PDFs using ExifTool in Docker. Supports local file paths and http(s) URLs (downloaded to temp, then cleaned up). Returns ExifTool JSON output (verbatim) by default.  A con",OSINT_DOCKER_IMAGE,no,https://exiftool.org/,https://exiftool.org/
Graphviz DOT Render Diagram,(none),graphviz-dot-render-diagram-mcp,langchain_tool,Open Source,langchain_tool,no,BUILD_NEW_MCP,Hackerdogs,OSS,Render Graphviz DOT (.dot/.gv) diagrams from file/url/content into SVG or PNG. Returns base64-encoded image plus metadata. Supports theme presets and Graphviz attribute overrides.,,no,https://graphviz.org/,https://graphviz.org/documentation/
Masscan,(none),masscan-mcp,langchain_tool,Open Source,langchain_tool,no,BUILD_NEW_MCP,Hackerdogs,OSS,Fast Internet port scanner using Masscan. Masscan is an Internet-scale port scanner that can scan the entire Internet in under 6 minutes. It uses asynchronous transmission and is capable of scanning m,,no,https://github.com/robertdavidgraham/masscan,https://github.com/robertdavidgraham/masscan
Mermaid Render Diagram,(none),mermaid-render-diagram-mcp,langchain_tool,Open Source,langchain_tool,no,BUILD_NEW_MCP,Hackerdogs,OSS,Render Mermaid (.mmd) diagrams from file/url/content into SVG or PNG. Returns base64-encoded image plus metadata. Supports Mermaid themes and background colors (default uses Hackerdogs branding colors,PLAYWRIGHT_BROWSER,no,https://github.com/seigok/mermaid-cli-python,https://github.com/seigok/mermaid-cli-python
Nuclei,(none),nuclei-mcp,langchain_tool,Open Source,langchain_tool,no,BUILD_NEW_MCP,ProjectDiscovery,OSS,"Scan target for vulnerabilities using Nuclei templates. Nuclei is a fast vulnerability scanner based on templates. It can detect CVEs, misconfigurations, and security issues. Supports filtering by sev",,no,https://github.com/projectdiscovery/nuclei,https://docs.projectdiscovery.io/opensource/nuclei/usage
PhoneInfoga Scan (Multi-scanner),(none),phoneinfoga-scan-multi-scanner-mcp,langchain_tool,Open Source,langchain_tool,no,BUILD_NEW_MCP,Hackerdogs,OSS,Run PhoneInfoga scan using selected scanners (local/numverify/googlesearch/googlecse/ovh). Executes the official Docker image and returns structured JSON parsed from stdout. Supports scanner API keys ,"GOOGLECSE_CX, GOOGLE_API_KEY, NUMVERIFY_API_KEY, GOOGLECSE_MAX_RESULTS",no,https://github.com/sundowndev/phoneinfoga,https://sundowndev.github.io/phoneinfoga/getting-started/usage/
VictoriaLogs Facets Tool,(none),victorialogs-facets-tool-mcp,langchain_tool,Log Management,langchain_tool,no,BUILD_NEW_MCP,VictorlaLogs (tool created by Hackerdogs),OSS,Get the most frequent values per each log field (facets) from VictoriaLogs. A discovery tool that identifies the most frequent values for every available log field. It helps users understand the distr,VICTORIALOGS_URL,no,,
VictoriaLogs Field Names Tool,(none),victorialogs-field-names-tool-mcp,langchain_tool,Log Management,langchain_tool,no,BUILD_NEW_MCP,VictorlaLogs (tool created by Hackerdogs),OSS,Get available field names from logs matching the query in VictoriaLogs. Discovery tools for navigating the schemaless nature of VictoriaLogs. Field Names retrieves all keys currently indexed in the lo,VICTORIALOGS_URL,no,,
VictoriaLogs Field Values Tool,(none),victorialogs-field-values-tool-mcp,langchain_tool,Log Management,langchain_tool,no,BUILD_NEW_MCP,VictorlaLogs (tool created by Hackerdogs),OSS,Get unique values for a specific field from logs matching the query in VictoriaLogs. Discovery tools for navigating the schemaless nature of VictoriaLogs. Field Names retrieves all keys currently inde,VICTORIALOGS_URL,no,,
VictoriaLogs Hits Tool,(none),victorialogs-hits-tool-mcp,langchain_tool,Log Management,langchain_tool,no,BUILD_NEW_MCP,VictorlaLogs (tool created by Hackerdogs),OSS,Analyze log hits over time in VictoriaLogs for time-series analysis. A time-series analysis tool that calculates the number of log entries (hits) matching a query over a specified time range. It retur,VICTORIALOGS_URL,no,,
VictoriaLogs Query Tool,(none),victorialogs-query-tool-mcp,langchain_tool,Log Management,langchain_tool,no,BUILD_NEW_MCP,Hackerdogs,OSS,"The primary interface for interacting with VictoriaLogs using LogsQL, a high-performance query language designed for full-text search and analytical pipes. This tool can query billions of logs across ",VICTORIALOGS_URL,no,,
VictoriaLogs Stats Range Tool,(none),victorialogs-stats-range-tool-mcp,langchain_tool,Log Management,langchain_tool,no,BUILD_NEW_MCP,VictorlaLogs (tool created by Hackerdogs),OSS,Run a stats query over a time range in VictoriaLogs to get time-series statistics. These tools run powerful aggregations and metrics calculations on log data. The Stats Tool provides instant aggregati,VICTORIALOGS_URL,no,,
VictoriaLogs Stats Tool,(none),victorialogs-stats-tool-mcp,langchain_tool,Log Management,langchain_tool,no,BUILD_NEW_MCP,VictorlaLogs (tool created by Haclerdogs),OSS,Run a stats query against VictoriaLogs to get aggregations and metrics. These tools run powerful aggregations and metrics calculations on log data. The Stats Tool provides instant aggregations (like t,VICTORIALOGS_URL,no,,
VictoriaLogs Stream Field Names Tool,(none),victorialogs-stream-field-names-tool-mcp,langchain_tool,Log Management,langchain_tool,no,BUILD_NEW_MCP,VictorlaLogs (tool created by Hackerdogs),OSS,"Get stream field names from log streams matching the query in VictoriaLogs. These tools manage and explore Log Streams, which are logical buckets of logs grouped by constant identifiers (like app, hos",VICTORIALOGS_URL,no,,
VictoriaLogs Stream Field Values Tool,(none),victorialogs-stream-field-values-tool-mcp,langchain_tool,Log Management,langchain_tool,no,BUILD_NEW_MCP,VictorlaLogs (tool created by Hackerdogs),OSS,"Get unique values for a specific stream field from log streams matching the query in VictoriaLogs. These tools manage and explore Log Streams, which are logical buckets of logs grouped by constant ide",VICTORIALOGS_URL,no,,
VictoriaLogs Streams Tool,(none),victorialogs-streams-tool-mcp,langchain_tool,Log Management,langchain_tool,no,BUILD_NEW_MCP,VictorlaLogs (tool created by Hackerdogs),OSS,Get log streams matching the query in VictoriaLogs.,VICTORIALOGS_URL,no,,
VictoriaLogs Tenants Tool,(none),victorialogs-tenants-tool-mcp,langchain_tool,Log Management,langchain_tool,no,BUILD_NEW_MCP,VictorlaLogs (tool created by Hackerdogs),OSS,Get list of available tenants in VictoriaLogs. A multi-tenancy management tool that retrieves a list of all available tenants within the VictoriaLogs instance. Each tenant is identified by an AccountI,VICTORIALOGS_URL,no,,
VirusTotal Domain Report,(none),virustotal-domain-report-mcp,langchain_tool,Threat Intelligence Platform,langchain_tool,no,BUILD_NEW_MCP,VirusTotal,OSS,"This tool queries VirusTotal's database for domain analysis results, providing threat intelligence about domains associated with malicious activity, phishing, malware distribution, or other security t",API_KEY,no,,
VirusTotal File Report,(none),virustotal-file-report-mcp,langchain_tool,Threat Intelligence Platform,langchain_tool,no,BUILD_NEW_MCP,VirusTotal,OSS,"Get VirusTotal analysis report for a file by hash (MD5, SHA1, or SHA256). A diagnostic tool that retrieves existing analysis data for a file based on its unique hash (MD5, SHA-1, or SHA-256). It provi",API_KEY,no,,
VirusTotal Get Url Analysis,(none),virustotal-get-url-analysis-mcp,langchain_tool,Threat Intelligence Platform,langchain_tool,no,BUILD_NEW_MCP,VirusTotal,OSS,"Get the results of a VirusTotal analysis by its analysis ID. A retrieval tool used to poll the results of a specific scan request using its unique Analysis ID. After a ""Scan URL"" task is submitted, th",API_KEY,no,,
VirusTotal IP Report,(none),virustotal-ip-report-mcp,langchain_tool,Threat Intelligence Platform,langchain_tool,no,BUILD_NEW_MCP,VirusTotal,OSS,"This tool queries VirusTotal's database for IP address analysis results, providing threat intelligence about IPs associated with malicious activity, command & control servers, botnets, DDoS attacks, o",API_KEY,no,,
VirusTotal Scan Url,(none),virustotal-scan-url-mcp,langchain_tool,Threat Intelligence Platform,langchain_tool,no,BUILD_NEW_MCP,VirusTotal,OSS,"This tool submits a URL to VirusTotal's scanning queue for analysis by multiple security engines. Unlike the report tools, this tool initiates a new scan rather than querying existing results. Use thi",API_KEY,no,,
VirusTotal URL Report,(none),virustotal-url-report-mcp,langchain_tool,Threat Intelligence Platform,langchain_tool,no,BUILD_NEW_MCP,VirusTotal,Commercial,Gets a URL report from Virus Total API. A lookup tool that retrieves the most recent security report for a specific web address. It aggregates results from various URL scanners and blocklisting servic,API_KEY,no,,
Waybackurls,(none),waybackurls-mcp,langchain_tool,Open Source,langchain_tool,no,BUILD_NEW_MCP,Hackerdogs,OSS,Fetch URLs from Wayback Machine using waybackpy Python package. This tool queries the Wayback Machine to retrieve historical URLs for a given domain. A digital archaeology tool that interfaces with th,,no,https://github.com/akamhy/waybackpy,https://github.com/akamhy/waybackpy
WebC Analyze Domain,(none),webc-analyze-domain-mcp,langchain_tool,Open Source,langchain_tool,no,BUILD_NEW_MCP,Hackerdogs,OSS,"Comprehensive domain analysis with DNS resolution, WHOIS lookup, and geolocation. Resolves domain to IPs, performs geolocation for each IP, retrieves WHOIS registration information, and parses domain ",,no,https://github.com/hackerdogs/hackerdogs-core,https://github.com/hackerdogs/hackerdogs-core
