tool_name,server_name,mcp_server_slug,type,tool_type,service_type,is_mcp_server,action,vendor,category,description,env_keys,has_existing_mcp,source_code_link,documentation_url
Ahima search1api MCP SERVER,search1api,search1api-mcp,npx,OSINT Tool,mcp_server,yes,REFACTOR_TO_DOCKER,https://github.com/fatwang2/search1api-mcp?tab=readme-ov-file,OSS,Features Web search functionality News search functionality Web page content extraction Website sitemap extraction Deep thinking and complex problem solving with DeepSeek R1 A versatile search and rea,,no,https://github.com/fatwang2/search1api-mcp?tab=readme-ov-file,https://github.com/fatwang2/search1api-mcp?tab=readme-ov-file
AI Text Detector MCP,ai-humanizer,ai-humanizer-mcp,npx,OSINT Tool,mcp_server,yes,REFACTOR_TO_DOCKER,Text2Go,OSS,"A Model Context Protocol (MCP) server designed to refine AI-generated content, making it sound more natural and human-like. It provides tools for AI detection, text enhancement, and grammar optimizati",,no,https://github.com/Text2Go/ai-humanizer-mcp-server,https://github.com/Text2Go/ai-humanizer-mcp-server
AWS API mcp server,aws-api,aws-api-mcp,uvx,Cloud Security Posture Management (CSPM),mcp_server,yes,REFACTOR_TO_DOCKER,AWS,OSS,The AWS API MCP Server enables AI assistants to interact with AWS services and resources through AWS CLI commands. It provides programmatic access to manage your AWS infrastructure while maintaining p,"AWS_REGION, AWS_PROFILE",no,https://github.com/awslabs/mcp/tree/main/src/aws-api-mcp-server,https://github.com/awslabs/mcp/tree/main/src/aws-api-mcp-server
AWS Aurora Postgres mcp server,aws-postgres,aws-postgres-mcp,uvx,Cloud Security Posture Management (CSPM),mcp_server,yes,REFACTOR_TO_DOCKER,Amazon,OSS,An AWS Labs Model Context Protocol (MCP) server for Aurora Postgres. A database intelligence tool that translates human-readable questions into structured Postgres-compatible SQL. It can execute these,,no,https://github.com/awslabs/mcp/tree/main/src/postgres-mcp-server,https://github.com/awslabs/mcp/tree/main/src/postgres-mcp-server
AWS Bedrock AgentCore mcp server,aws-bedrock-agentcore,aws-bedrock-agentcore-mcp,uvx,Cloud Security Posture Management (CSPM),mcp_server,yes,REFACTOR_TO_DOCKER,Amazon,OSS,"Model Context Protocol (MCP) server for Amazon Bedrock AgentCore services  This MCP server provides comprehensive access to Amazon Bedrock AgentCore documentation, enabling developers to search and re","AWS_REGION, AWS_ACCESS_KEY_ID, AWS_SECRET_ACCESS_KEY",no,https://github.com/awslabs/mcp/tree/main/src/amazon-bedrock-agentcore-mcp-server,https://github.com/awslabs/mcp/tree/main/src/amazon-bedrock-agentcore-mcp-server
AWS Bedrock custom model mcp server,aws-bedrock-custom-model,aws-bedrock-custom-model-mcp,uvx,Cloud Security Posture Management (CSPM),mcp_server,yes,REFACTOR_TO_DOCKER,Amazon,OSS,The Bedrock Custom Model Import Model Context Protocol (MCP) Server streamlines the process of importing custom models into Amazon Bedrock. It provides a comprehensive set of tools for managing model ,"AWS_REGION, AWS_SECRET_ACCESS_KEY",no,https://github.com/awslabs/mcp/tree/main/src/aws-bedrock-custom-model-import-mcp-server,https://github.com/awslabs/mcp/tree/main/src/aws-bedrock-custom-model-import-mcp-server
AWS CloudTrail mcp server,aws-cloudtrail,aws-cloudtrail-mcp,uvx,Incident Response Platform,mcp_server,yes,REFACTOR_TO_DOCKER,Amazon,OSS,"This AWS Labs Model Context Protocol (MCP) server for CloudTrail enables your AI agents to query AWS account activity for security investigations, compliance auditing, and operational troubleshooting.","AWS_REGION, AWS_SECRET_ACCESS_KEY",no,https://github.com/awslabs/mcp/tree/main/src/cloudtrail-mcp-server,https://github.com/awslabs/mcp/tree/main/src/cloudtrail-mcp-server
AWS Cloudwatch ApSignals mcp server,aws-cloudwatch-appsignals,aws-cloudwatch-appsignals-mcp,uvx,Cloud Security Posture Management (CSPM),mcp_server,yes,REFACTOR_TO_DOCKER,Amazon,OSS,"An MCP (Model Context Protocol) server that provides comprehensive tools for monitoring and analyzing AWS services using AWS Application Signals.  This server enables AI assistants like Kiro, Claude, ","AWS_REGION, AWS_ACCESS_KEY_ID, AWS_SECRET_ACCESS_KEY",no,https://github.com/awslabs/mcp/tree/main/src/cloudwatch-applicationsignals-mcp-server,https://github.com/awslabs/mcp/tree/main/src/cloudwatch-applicationsignals-mcp-server
AWS Cloudwatch mcp server,aws-cloudwatch,aws-cloudwatch-mcp,uvx,Cloud Security Posture Management (CSPM),mcp_server,yes,REFACTOR_TO_DOCKER,Amazon,OSS,This AWS Labs Model Context Protocol (MCP) server for CloudWatch enables your troubleshooting agents to use CloudWatch data to do AI-powered root cause analysis and provide recommendations. It offers ,"AWS_REGION, AWS_ACCESS_KEY_ID, AWS_SECRET_ACCESS_KEY",no,https://github.com/awslabs/mcp/tree/main/src/cloudwatch-mcp-server,https://github.com/awslabs/mcp/tree/main/src/cloudwatch-mcp-server
AWS Core mcp server,aws-core,aws-core-mcp,uvx,Cloud Security Posture Management (CSPM),mcp_server,yes,REFACTOR_TO_DOCKER,aws,OSS,MCP server that provides a starting point for using AWS MCP servers through a dynamic proxy server strategy based on role-based environment variables.,"AWS_REGION, AWS_PROFILE",no,https://github.com/awslabs/mcp/tree/main/src/core-mcp-server,https://github.com/awslabs/mcp/tree/main/src/core-mcp-server
AWS Documentation mcp server,aws-documentation,aws-documentation-mcp,uvx,Cloud Security Posture Management (CSPM),mcp_server,yes,REFACTOR_TO_DOCKER,Amazon,OSS,"Model Context Protocol (MCP) server for AWS Documentation  This MCP server provides tools to access AWS documentation, search for content, and get recommendations.",,no,https://github.com/awslabs/mcp/tree/main/src/aws-documentation-mcp-server,https://github.com/awslabs/mcp/tree/main/src/aws-documentation-mcp-server
AWS Documentdb mcp server,aws-documentdb,aws-documentdb-mcp,uvx,Cloud Security Posture Management (CSPM),mcp_server,yes,REFACTOR_TO_DOCKER,Amazon,OSS,An AWS Labs Model Context Protocol (MCP) server for AWS DocumentDB that enables AI assistants to interact with DocumentDB databases.  Overview The DocumentDB MCP Server provides tools to connect to an,"AWS_REGION, AWS_ACCESS_KEY_ID, AWS_SECRET_ACCESS_KEY",no,https://github.com/awslabs/mcp/tree/main/src/documentdb-mcp-server,https://github.com/awslabs/mcp/tree/main/src/documentdb-mcp-server
AWS DSQL mcp server,aws-aurora-dsql,aws-aurora-dsql-mcp,uvx,Cloud Security Posture Management (CSPM),mcp_server,yes,REFACTOR_TO_DOCKER,Amazon,Commercial,An AWS Labs Model Context Protocol (MCP) server for Aurora DSQL and corresponding AI rules that can be used for additional model steering while developing.  Features Converting human-readable question,"AWS_REGION, AWS_ACCESS_KEY_ID, AWS_SECRET_ACCESS_KEY",no,https://github.com/awslabs/mcp/tree/main/src/aurora-dsql-mcp-server,https://github.com/awslabs/mcp/tree/main/src/aurora-dsql-mcp-server
AWS DynamoDB mcp server,aws-dynamodb,aws-dynamodb-mcp,uvx,Cloud Security Posture Management (CSPM),mcp_server,yes,REFACTOR_TO_DOCKER,Amazon,OSS,The official developer experience MCP Server for Amazon DynamoDB. This server provides DynamoDB expert design guidance and data modeling assistance.  Available Tools The DynamoDB MCP server provides s,,no,https://github.com/awslabs/mcp/tree/main/src/dynamodb-mcp-server,https://github.com/awslabs/mcp/tree/main/src/dynamodb-mcp-server
AWS ECS mcp server,aws-ecs,aws-ecs-mcp,uvx,Cloud Security Posture Management (CSPM),mcp_server,yes,REFACTOR_TO_DOCKER,Amazon,OSS,"An MCP server for containerizing applications, deploying applications to Amazon Elastic Container Service (ECS), troubleshooting ECS deployments, and managing ECS resources. This server enables AI ass","AWS_REGION, AWS_ACCESS_KEY_ID, AWS_SECRET_ACCESS_KEY",no,https://github.com/awslabs/mcp/tree/main/src/ecs-mcp-server,https://github.com/awslabs/mcp/tree/main/src/ecs-mcp-server
AWS EKS mcp server,aws-eks,aws-eks-mcp,uvx,Cloud Security Posture Management (CSPM),mcp_server,yes,REFACTOR_TO_DOCKER,Amazon,OSS,The Amazon EKS MCP server provides AI code assistants with resource management tools and real-time cluster state visibility. This provides large language models (LLMs) with essential tooling and conte,"AWS_REGION, AWS_ACCESS_KEY_ID, AWS_SECRET_ACCESS_KEY",no,https://github.com/awslabs/mcp/tree/main/src/eks-mcp-server,https://github.com/awslabs/mcp/tree/main/src/eks-mcp-server
AWS IAM mcp server,aws-iam,aws-iam-mcp,uvx,Cloud Security Posture Management (CSPM),mcp_server,yes,REFACTOR_TO_DOCKER,Amazon,OSS,"A Model Context Protocol (MCP) server for comprehensive AWS Identity and Access Management (IAM) operations. This server provides AI assistants with the ability to manage IAM users, roles, policies, a","AWS_REGION, AWS_ACCESS_KEY_ID, AWS_SECRET_ACCESS_KEY",no,https://github.com/awslabs/mcp/tree/main/src/iam-mcp-server,https://github.com/awslabs/mcp/tree/main/src/iam-mcp-server
AWS MQ mcp server,aws-mq,aws-mq-mcp,uvx,Cloud Security Posture Management (CSPM),mcp_server,yes,REFACTOR_TO_DOCKER,Amazon,OSS,A Model Context Protocol (MCP) server for Amazon MQ that enables generative AI models to manage RabbitMQ and ActiveMQ message brokers through MCP tools.  Features This MCP server acts as a bridge betw,,no,https://github.com/awslabs/mcp/tree/main/src/amazon-mq-mcp-server,https://github.com/awslabs/mcp/tree/main/src/amazon-mq-mcp-server
AWS Neptune mcp server,aws-neptune,aws-neptune-mcp,uvx,Cloud Security Posture Management (CSPM),mcp_server,yes,REFACTOR_TO_DOCKER,Amazon,OSS,"An Amazon Neptune MCP server that allows for fetching status, schema, and querying using openCypher and Gremlin for Neptune Database and openCypher for Neptune Analytics.  Features The Amazon Neptune ","AWS_REGION, AWS_ACCESS_KEY_ID, AWS_SECRET_ACCESS_KEY",no,https://github.com/awslabs/mcp/tree/main/src/amazon-neptune-mcp-server,https://github.com/awslabs/mcp/tree/main/src/amazon-neptune-mcp-server
AWS Network mcp server,aws-network,aws-network-mcp,uvx,Cloud Security Posture Management (CSPM),mcp_server,yes,REFACTOR_TO_DOCKER,Amazon,OSS,"A Model Context Protocol (MCP) server providing comprehensive tools for troubleshooting and analyzing AWS core networking services including Cloud WAN, Transit Gateway, VPC, Network Firewall, and VPN ","AWS_REGION, AWS_ACCESS_KEY_ID, AWS_SECRET_ACCESS_KEY",no,https://github.com/awslabs/mcp/tree/main/src/aws-network-mcp-server,https://github.com/awslabs/mcp/tree/main/src/aws-network-mcp-server
AWS Prometheus mcp server,aws-prometheus,aws-prometheus-mcp,uvx,Cloud Security Posture Management (CSPM),mcp_server,yes,REFACTOR_TO_DOCKER,Amazon,OSS,"The Prometheus MCP Server provides a robust interface for interacting with AWS Managed Prometheus, enabling users to execute PromQL queries, list metrics, and retrieve server information with AWS SigV","AWS_REGION, AWS_ACCESS_KEY_ID, AWS_SECRET_ACCESS_KEY",no,https://github.com/awslabs/mcp/tree/main/src/prometheus-mcp-server,https://github.com/awslabs/mcp/tree/main/src/prometheus-mcp-server
AWS Redshift mcp server,aws-redshift,aws-redshift-mcp,uvx,Cloud Security Posture Management (CSPM),mcp_server,yes,REFACTOR_TO_DOCKER,Amazon,OSS,"Model Context Protocol (MCP) server for Amazon Redshift.  This MCP server provides tools to discover, explore, and query Amazon Redshift clusters and serverless workgroups. It enables AI assistants to","AWS_REGION, AWS_ACCESS_KEY_ID, AWS_SECRET_ACCESS_KEY",no,https://github.com/awslabs/mcp/tree/main/src/redshift-mcp-server,https://github.com/awslabs/mcp/tree/main/src/redshift-mcp-server
AWS S3 tables mcp server,aws-s3-tables,aws-s3-tables-mcp,uvx,Cloud Security Posture Management (CSPM),mcp_server,yes,REFACTOR_TO_DOCKER,Amazon,OSS,"The S3 Tables MCP Server simplifies the management of S3-based tables by providing capabilities to generate and query tables, generate tables directly from CSV files uploaded to S3, and access metadat","AWS_REGION, AWS_ACCESS_KEY_ID, AWS_SECRET_ACCESS_KEY",no,https://github.com/awslabs/mcp/tree/main/src/s3-tables-mcp-server,https://github.com/awslabs/mcp/tree/main/src/s3-tables-mcp-server
AWS Serverless mcp server,aws-serverless,aws-serverless-mcp,uvx,Cloud Security Posture Management (CSPM),mcp_server,yes,REFACTOR_TO_DOCKER,Amazon,OSS,The AWS Serverless Model Context Protocol (MCP) Server is an open-source tool that combines AI assistance with serverless expertise to streamline how developers build serverless applications. It provi,"AWS_REGION, AWS_ACCESS_KEY_ID, AWS_SECRET_ACCESS_KEY",no,https://github.com/awslabs/mcp/tree/main/src/aws-serverless-mcp-server,https://github.com/awslabs/mcp/tree/main/src/aws-serverless-mcp-server
AWS SNS SQS mcp server,aws-sns-sqs,aws-sns-sqs-mcp,uvx,Cloud Security Posture Management (CSPM),mcp_server,yes,REFACTOR_TO_DOCKER,Amazon,OSS,A Model Context Protocol (MCP) server for Amazon SNS / SQS that enables generative AI models to manage SNS Topics and SQS Queues through MCP tools.  Features This MCP server acts as a bridge between M,,no,https://github.com/awslabs/mcp/tree/main/src/amazon-sns-sqs-mcp-server,https://github.com/awslabs/mcp/tree/main/src/amazon-sns-sqs-mcp-server
AWS Step Functions mcp server,aws-stepfunctions,aws-stepfunctions-mcp,uvx,Cloud Security Posture Management (CSPM),mcp_server,yes,REFACTOR_TO_DOCKER,Amazon,Commercial,A Model Context Protocol (MCP) server for AWS Step Functions to choose and run state machines as MCP tools without code changes.  This MCP server acts as a bridge between MCP clients and AWS Step Func,"AWS_REGION, AWS_ACCESS_KEY_ID, AWS_SECRET_ACCESS_KEY",no,https://github.com/awslabs/mcp/tree/main/src/stepfunctions-tool-mcp-server,https://github.com/awslabs/mcp/tree/main/src/stepfunctions-tool-mcp-server
AWS Well Architectured Security mcp server,aws-well-architected-security,aws-well-architected-security-mcp,uvx,Cloud Security Posture Management (CSPM),mcp_server,yes,REFACTOR_TO_DOCKER,Amazon,OSS,A Model Context Protocol (MCP) server that provides operational tools for monitoring and assessing AWS environments against the AWS Well-Architected Framework Security Pillar. This server enables AI a,,no,https://github.com/awslabs/mcp/tree/main/src/well-architected-security-mcp-server,https://github.com/awslabs/mcp/tree/main/src/well-architected-security-mcp-server
Azure,azure,azure-mcp,npx,Cloud Security Posture Management (CSPM),mcp_server,yes,REFACTOR_TO_DOCKER,,Commercial,"Azure MCP server allows an AI client to authenticate with Azure and interact with Azure resources through the Azure APIs. With the configured environment variables and permissions, the AI can inspect ","AZURE_CLIENT_ID, AZURE_TENANT_ID, AZURE_CLIENT_SECRET, AZURE_SUBSCRIPTION_ID",no,,
Baidu Search MCP Server,baidu-search-mcp-server,baidu-search-mcp-server-mcp,uvx,Web Search,mcp_server,yes,REFACTOR_TO_DOCKER,https://github.com/Evilran/baidu-mcp-server,OSS,"A Model Context Protocol (MCP) server that provides web search capabilities through Baidu, with additional features for content fetching and parsing. Features Web Search: Search Baidu with advanced ra",,no,https://github.com/Evilran/baidu-mcp-server,https://github.com/Evilran/baidu-mcp-server
Bitbucket MCP Server,bitbucket,bitbucket-mcp,npx,Forensics Tool,mcp_server,yes,REFACTOR_TO_DOCKER,https://github.com/MatanYemini/bitbucket-mcp,OSS,"A Model Context Protocol (MCP) server for integrating with Bitbucket Cloud and Server APIs. This MCP server enables AI assistants like Cursor to interact with your Bitbucket repositories, pull request",,no,https://github.com/MatanYemini/bitbucket-mcp,https://github.com/MatanYemini/bitbucket-mcp
BraveSearch MCP,brave-search,brave-search-mcp,npx,OSINT Tool,mcp_server,yes,REFACTOR_TO_DOCKER,https://github.com/brave/brave-search-mcp-server,OSS,"Web Search (brave_web_search) Performs comprehensive web searches with rich result types and advanced filtering options.  Parameters:  query (string, required): Search terms (max 400 chars, 50 words) ",,no,https://github.com/brave/brave-search-mcp-server,https://github.com/brave/brave-search-mcp-server
Bright data mcp server,brightdata_mcp_server,brightdata-mcp-server-mcp,npx,OSINT Tool,mcp_server,yes,REFACTOR_TO_DOCKER,bright data,Commercial,"Discover, access, extract, and interact with any public website. Get structured, reliable, real-time or historical data at petabyte-scale. Ready for any model, pipeline, or workflow. A petabyte-scale ",,no,https://brightdata.com/cp/start,https://brightdata.com/cp/start
Chrome Devtools MCP,chrome-devtools,chrome-devtools-mcp,npx,OSINT Tool,mcp_server,yes,REFACTOR_TO_DOCKER,,OSS,"A Model Context Protocol (MCP) server that connects AI coding agents (such as Claude, Gemini, or Copilot) to a live Chrome browser. It leverages the Chrome DevTools Protocol to enable automation, in-d",,no,https://github.com/ChromeDevTools/chrome-devtools-mcp,https://github.com/ChromeDevTools/chrome-devtools-mcp
ClinicalTrials Gov MCP,clinicaltrialsgov-mcp-server,clinicaltrialsgov-mcp-server-mcp,npx,OSINT Tool,mcp_server,yes,REFACTOR_TO_DOCKER,cyanheads,OSS,"A Model Context Protocol (MCP) server that connects AI assistants to the official ClinicalTrials.gov REST API. It enables LLMs to search, retrieve, analyze, and compare clinical trial data, as well as","MCP_LOG_LEVEL, MCP_TRANSPORT_TYPE",no,https://github.com/cyanheads/clinicaltrialsgov-mcp-server,https://github.com/cyanheads/clinicaltrialsgov-mcp-server
Cloudflare,cloudflare,cloudflare-mcp,npx,Collaboration,mcp_server,yes,REFACTOR_TO_DOCKER,,Commercial,"Cloudflare's Model Context Protocol (MCP) support allows developers to build, deploy, and host MCP servers on the Cloudflare Workers platform. MCP is an open standard that connects AI agents (like Cla",CLOUDFLARE_API_TOKEN,no,,
Context7,context7,context7-mcp,npx,Web Search,mcp_server,yes,REFACTOR_TO_DOCKER,,Commercial,"Context7 MCP is a Model Context Protocol server that injects real-time, version-specific documentation and code examples directly into AI prompts. It is designed to solve ""knowledge cutoff"" issues whe",,no,,
Copyseeker MCP Server,RapidAPI Hub - Reverse image search by Copyseeker,rapidapi-hub-reverse-image-search-by-copyseeker-mcp,npx,Web Search,mcp_server,yes,REFACTOR_TO_DOCKER,Copyseeker,OSS,A Model Context Protocol (MCP) server that integrates Copyseeker's powerful reverse image search API with Claude and other MCP-compatible AI assistants.  An AI-powered reverse image search server that,,no,https://copyseeker.net/,https://www.npmjs.com/package/copyseeker-mcp-server
DNS MCP Server,dns-mcp-server,dns-mcp-server-mcp,npx,Network Monitoring,mcp_server,yes,REFACTOR_TO_DOCKER,https://github.com/cenemil/dns-mcp-server,Commercial,A Model Context Protocol (MCP) server that provides comprehensive DNS lookup capabilities to AI assistants. A comprehensive DNS diagnostic tool for AI assistants. It supports a wide array of record ty,,no,https://github.com/cenemil/dns-mcp-server,https://github.com/cenemil/dns-mcp-server
DNStwist MCP Server,dnstwist-mcp,dnstwist-mcp,npx,Network Monitoring,mcp_server,yes,REFACTOR_TO_DOCKER,https://github.com/BurtTheCoder/mcp-dnstwist,OSS,"A Model Context Protocol (MCP) server for dnstwist, a powerful DNS fuzzing tool that helps detect typosquatting, phishing, and corporate espionage. This server provides tools for analyzing domain perm",,no,https://github.com/BurtTheCoder/mcp-dnstwist,https://github.com/BurtTheCoder/mcp-dnstwist
Duckduckgo,duckduckgo,duckduckgo-mcp,uvx,Web Search,mcp_server,yes,REFACTOR_TO_DOCKER,,Commercial,The DuckDuckGo MCP (Model Context Protocol) server is a community-driven tool that allows AI models (like Claude or those in IDEs like Cursor) to perform web searches and fetch webpage content using t,,no,,
EXA LABS MCP,exa,exa-mcp,npx,OSINT Tool,mcp_server,yes,REFACTOR_TO_DOCKER,https://github.com/exa-labs/exa-mcp-server,OSS,"A high-precision web search tool specifically engineered for AI coding agents. Powered by the Exa neural search engine, it retrieves token-efficient context from billions of GitHub repositories, docum",,no,https://github.com/exa-labs/exa-mcp-server,https://github.com/exa-labs/exa-mcp-server
Exiftool MCP,Exiftool-agent,exiftool-agent-mcp,npx,OSINT Tool,mcp_server,yes,REFACTOR_TO_DOCKER,vgribok,OSS,exiftool-mcp-server is a Model Context Protocol (MCP) server that acts as a bridge between AI agents (like Claude) and the powerful ExifTool command-line utility. It allows an AI to read EXIF metadata,,no,https://github.com/vgribok/exiftool-mcp-server,https://github.com/vgribok/exiftool-mcp-server
Fetch,fetch,fetch-mcp,uvx,Web Search,mcp_server,yes,REFACTOR_TO_DOCKER,,Commercial,"Fetch MCP Server is a tool that allows Large Language Models (LLMs) to retrieve, read, and process content from public websites and local networks. It converts HTML into Markdown, supports chunked rea",,no,https://github.com/modelcontextprotocol/servers/tree/main/src/fetch,
Firecrawl MCP,firecrawl-mcp,firecrawl-mcp,npx,OSINT Tool,mcp_server,yes,REFACTOR_TO_DOCKER,firecrawl,OSS,"An advanced web scraping and crawling server engineered for deep data extraction. Unlike simple fetchers, it handles JavaScript rendering, anti-bot protections, and deep site mapping. It includes a sp",FIRECRAWL_API_KEY,no,https://github.com/firecrawl/firecrawl-mcp-server,https://github.com/firecrawl/firecrawl-mcp-server
Geocode MCP Server,geocoding,geocoding-mcp,uvx,OSINT Tool,mcp_server,yes,REFACTOR_TO_DOCKER,https://github.com/X-McKay/geocode-mcp,OSS,A Model Context Protocol (MCP) server that provides latitude/longitude coordinates for cities and locations using the OpenStreetMap Nominatim API. It is a location intelligence server that provides gl,,no,https://github.com/X-McKay/geocode-mcp,https://github.com/X-McKay/geocode-mcp
Gitlab,gitlab,gitlab-mcp,npx,Code Analysis Tool,mcp_server,yes,REFACTOR_TO_DOCKER,,Commercial,"This configuration launches the GitLab Model Context Protocol (MCP) server via npx, which enables an AI client to make authenticated API calls to GitLab on your behalf. Using your personal access toke","GITLAB_API_URL, GITLAB_PERSONAL_ACCESS_TOKEN",no,,
Globalping MCP SERVER,globalping,globalping-mcp,npx,OSINT Tool,mcp_server,yes,REFACTOR_TO_DOCKER,https://github.com/jsdelivr/globalping-mcp-server,OSS,"What is Globalping? Globalping is a free, public API that provides access to a globally distributed network of probes for monitoring, debugging, and benchmarking internet infrastructure. With Globalpi",,no,https://github.com/jsdelivr/globalping-mcp-server,https://github.com/jsdelivr/globalping-mcp-server
Google SecOps,secops,secops-mcp,uvx,Incident Response Platform,mcp_server,yes,REFACTOR_TO_DOCKER,google,OSS,"This server provides tools for interacting with Chronicle Security Operations using the secops-py library.  This MCP server is built on top of the official Google SecOps SDK for Python, which provides","CHRONICLE_REGION, CHRONICLE_PROJECT_ID, CHRONICLE_CUSTOMER_ID",no,https://github.com/google/mcp-security,https://google.github.io/mcp-security/servers/secops_mcp.html
Google Security Command Center (SCC),scc,scc-mcp,uvx,Incident Response Platform,mcp_server,yes,REFACTOR_TO_DOCKER,google,OSS,This server provides tools for interacting with Google Cloud Security Command Center (SCC) and Cloud Asset Inventory (CAI). A cloud security management tool for interacting with Google Cloud's SCC and,,no,https://github.com/google/mcp-security,https://google.github.io/mcp-security/servers/scc_mcp.html
Google Threat Intelligence,google-threat-intelligence,google-threat-intelligence-mcp,uvx,Threat Intelligence Platform,mcp_server,yes,REFACTOR_TO_DOCKER,google,OSS,"A centralized hub providing access to Google’s premier threat intelligence data, including insights from Mandiant and VirusTotal. It allows security professionals to use natural language to query TTPs",VT_APIKEY,no,https://github.com/google/mcp-security,https://google.github.io/mcp-security/
GreyNoise MCP,greynoise,greynoise-mcp,npx,OSINT Tool,mcp_server,yes,REFACTOR_TO_DOCKER,GreyNoise-Intelligence,OSS,"A Model Context Protocol (MCP) server that connects AI assistants to the GreyNoise Enterprise API. It enables comprehensive analysis of internet-scanning IPs, threat actors, and vulnerabilities, provi",,no,https://github.com/GreyNoise-Intelligence/greynoise-mcp-server,https://github.com/GreyNoise-Intelligence/greynoise-mcp-server
Have I Been Pwned MCP Server,HIBP-MCP,hibp-mcp,npx,Threat Intelligence Platform,mcp_server,yes,REFACTOR_TO_DOCKER,https://github.com/darrenjrobinson/HIBP-MCP-Server,OSS,Have I Been Pwned MCP Server  A Model Context Protocol (MCP) server that interfaces with the Have I Been Pwned (HIBP) API to investigate data breaches. It allows AI agents to check if an email or phon,,no,https://github.com/darrenjrobinson/HIBP-MCP-Server,https://github.com/darrenjrobinson/HIBP-MCP-Server
IMF MCP SERVER,imf-data,imf-data-mcp,uvx,OSINT Tool,mcp_server,yes,REFACTOR_TO_DOCKER,https://github.com/c-cf/imf-data-mcp,OSS,"IMF Data MCP This MCP server integrates with the free IMF data API to provide a set of tools and resources for retrieving and processing economic data. It enables users to query datasets, fetch time s",,no,https://github.com/c-cf/imf-data-mcp,https://github.com/c-cf/imf-data-mcp
IPLocate.io MCP Server,iplocate,iplocate-mcp,npx,Network Monitoring,mcp_server,yes,REFACTOR_TO_DOCKER,https://github.com/iplocate/mcp-server-iplocate,OSS,"An MCP (Model Context Protocol) server for IPLocate.io - providing comprehensive IP address intelligence including geolocation, network information, privacy detection, and abuse contacts.  A comprehen",,no,https://github.com/iplocate/mcp-server-iplocate,https://github.com/iplocate/mcp-server-iplocate
