tool_name,server_name,mcp_server_slug,type,tool_type,service_type,is_mcp_server,action,vendor,category,description,env_keys,has_existing_mcp,source_code_link,documentation_url
WebC Analyze Text,(none),webc-analyze-text-mcp,langchain_tool,Open Source,langchain_tool,no,BUILD_NEW_MCP,Hackerdogs,OSS,"Comprehensive text analysis with statistics and insights. Analyzes text for word count, character count, sentence count, average word length, language detection, and readability metrics. Use for conte",,no,https://github.com/hackerdogs/hackerdogs-core,https://github.com/hackerdogs/hackerdogs-core
WebC Analyze Webpage,(none),webc-analyze-webpage-mcp,langchain_tool,Open Source,langchain_tool,no,BUILD_NEW_MCP,Hackerdogs,OSS,"Comprehensive webpage analysis with full metadata extraction and intelligence gathering. Fetches HTML content, extracts visible text, detects language, extracts metadata (title, description, keywords)",,no,https://github.com/hackerdogs/hackerdogs-core,https://github.com/hackerdogs/hackerdogs-core
WebC Calculate Geo Distance,(none),webc-calculate-geo-distance-mcp,langchain_tool,Open Source,langchain_tool,no,BUILD_NEW_MCP,Hackerdogs,OSS,"Calculate distance between two geographic coordinates. Uses Haversine formula to calculate great-circle distance. Returns distance in kilometers and miles. Use for geographic distance calculations, lo",,no,https://github.com/hackerdogs/hackerdogs-core,https://github.com/hackerdogs/hackerdogs-core
WebC Calculate Geodomain Distance,(none),webc-calculate-geodomain-distance-mcp,langchain_tool,Open Source,langchain_tool,no,BUILD_NEW_MCP,Hackerdogs,OSS,"Calculate distance between two domains based on their IP geolocations. Resolves domains to IPs, gets geolocations, and calculates geographic distance. Returns distance in kilometers and miles. Use for",,no,https://github.com/hackerdogs/hackerdogs-core,https://github.com/hackerdogs/hackerdogs-core
WebC Calculate GeoIP Distance,(none),webc-calculate-geoip-distance-mcp,langchain_tool,Open Source,langchain_tool,no,BUILD_NEW_MCP,Hackerdogs,OSS,Calculate distance between two IP addresses based on geolocation. Resolves IPs to locations and calculates geographic distance. Returns distance in kilometers and miles. Use for IP-based geographic an,,no,https://github.com/hackerdogs/hackerdogs-core,https://github.com/hackerdogs/hackerdogs-core
WebC Calculate Similarity spaCy,(none),webc-calculate-similarity-spacy-mcp,langchain_tool,Open Source,langchain_tool,no,BUILD_NEW_MCP,Hackerdogs,OSS,Calculate text similarity using spaCy word embeddings. Uses semantic similarity based on word vectors for more accurate semantic comparison. Use for semantic text comparison or when you need NLP-based,,no,https://github.com/hackerdogs/hackerdogs-core,https://github.com/hackerdogs/hackerdogs-core
WebC Calculate Text Similarity,(none),webc-calculate-text-similarity-mcp,langchain_tool,Open Source,langchain_tool,no,BUILD_NEW_MCP,Hackerdogs,OSS,"Calculate similarity between two text strings using multiple algorithms (Jaccard, Cosine, Levenshtein, etc.). Returns similarity scores from different methods for comprehensive comparison. Use for con",,no,https://github.com/hackerdogs/hackerdogs-core,https://github.com/hackerdogs/hackerdogs-core
WebC Detect Language,(none),webc-detect-language-mcp,langchain_tool,Open Source,langchain_tool,no,BUILD_NEW_MCP,Hackerdogs,OSS,"Detect the primary language of text or webpage content. Supports detection from text strings or by fetching and analyzing webpage content. Returns ISO 639-1 language code (e.g., en, fr, es). Use for l",,no,https://github.com/hackerdogs/hackerdogs-core,https://github.com/hackerdogs/hackerdogs-core
WebC Detect Multiple Languages,(none),webc-detect-multiple-languages-mcp,langchain_tool,Open Source,langchain_tool,no,BUILD_NEW_MCP,Hackerdogs,OSS,Detect all languages present in text or webpage with confidence scores. Returns multiple language candidates with their confidence levels. Useful for multi-language content or when primary language de,,no,https://github.com/hackerdogs/hackerdogs-core,https://github.com/hackerdogs/hackerdogs-core
WebC Extract Emails,(none),webc-extract-emails-mcp,langchain_tool,Open Source,langchain_tool,no,BUILD_NEW_MCP,Hackerdogs,OSS,Extract email addresses from text or webpage. Supports extraction from text strings or by fetching and analyzing webpage content. Returns list of unique email addresses and their domains. Use for cont,,no,https://github.com/hackerdogs/hackerdogs-core,https://github.com/hackerdogs/hackerdogs-core
WebC Extract Entities,(none),webc-extract-entities-mcp,langchain_tool,Open Source,langchain_tool,no,BUILD_NEW_MCP,Hackerdogs,OSS,"Extract named entities (people, organizations, locations, dates, etc.) from text using NLP. Uses spaCy for entity recognition. Returns structured entity data with types (PERSON, ORG, GPE, DATE, etc.).",,no,https://github.com/hackerdogs/hackerdogs-core,https://github.com/hackerdogs/hackerdogs-core
WebC Extract Key Terms,(none),webc-extract-key-terms-mcp,langchain_tool,Open Source,langchain_tool,no,BUILD_NEW_MCP,Hackerdogs,OSS,"Extract key terms from text using multiple algorithms (TF-IDF, YAKE, etc.). Returns important keywords and phrases ranked by relevance. Use for keyword extraction, topic identification, or content sum",,no,https://github.com/hackerdogs/hackerdogs-core,https://github.com/hackerdogs/hackerdogs-core
WebC Extract Key Terms TextRank,(none),webc-extract-key-terms-textrank-mcp,langchain_tool,Open Source,langchain_tool,no,BUILD_NEW_MCP,Hackerdogs,OSS,Extract key terms from text using TextRank algorithm. TextRank is a graph-based ranking algorithm that identifies important keywords based on word co-occurrence. Use for keyword extraction when you ne,,no,https://github.com/hackerdogs/hackerdogs-core,https://github.com/hackerdogs/hackerdogs-core
WebC Extract Text,(none),webc-extract-text-mcp,langchain_tool,Open Source,langchain_tool,no,BUILD_NEW_MCP,Hackerdogs,OSS,"Extract visible text content from a webpage. Fetches HTML and extracts all visible text while excluding scripts, styles, and other non-visible elements. Faster than full webpage analysis when you only",,no,https://github.com/hackerdogs/hackerdogs-core,https://github.com/hackerdogs/hackerdogs-core
WebC Find Sensitive Data,(none),webc-find-sensitive-data-mcp,langchain_tool,Open Source,langchain_tool,no,BUILD_NEW_MCP,Hackerdogs,OSS,"Detect sensitive data (PII, credit cards, SSN, phone numbers, etc.) in text. Uses pattern matching and validation to identify potentially sensitive information. Returns detected data types and locatio",,no,https://github.com/hackerdogs/hackerdogs-core,https://github.com/hackerdogs/hackerdogs-core
WebC Get Certificate Info,(none),webc-get-certificate-info-mcp,langchain_tool,Open Source,langchain_tool,no,BUILD_NEW_MCP,Hackerdogs,OSS,"Get SSL/TLS certificate information for a hostname. Returns certificate details including issuer, validity dates, subject, SANs, and certificate chain. Use for certificate analysis, security assessmen",,no,https://github.com/hackerdogs/hackerdogs-core,https://github.com/hackerdogs/hackerdogs-core
WebC Get Domain TLD Info,(none),webc-get-domain-tld-info-mcp,langchain_tool,Open Source,langchain_tool,no,BUILD_NEW_MCP,Hackerdogs,OSS,"Get top-level domain (TLD) information for a domain. Returns TLD details, domain components, and TLD metadata. Use for domain parsing, TLD analysis, or understanding domain structure.",,no,https://github.com/hackerdogs/hackerdogs-core,https://github.com/hackerdogs/hackerdogs-core
WebC Get Domain WHOIS,(none),webc-get-domain-whois-mcp,langchain_tool,Open Source,langchain_tool,no,BUILD_NEW_MCP,Hackerdogs,OSS,"Get WHOIS registration information for a domain. Returns registration details including registrar, creation date, expiration date, name servers, and registrant information. Use for domain ownership ve",,no,https://github.com/hackerdogs/hackerdogs-core,https://github.com/hackerdogs/hackerdogs-core
WebC Get IP Location,(none),webc-get-ip-location-mcp,langchain_tool,Open Source,langchain_tool,no,BUILD_NEW_MCP,Hackerdogs,OSS,"Get geolocation information for an IP address. Returns city, country, latitude, longitude, and other location data. Use for IP geolocation, geographic analysis, or understanding where network traffic ",,no,https://github.com/hackerdogs/hackerdogs-core,https://github.com/hackerdogs/hackerdogs-core
WebC Get IP WHOIS,(none),webc-get-ip-whois-mcp,langchain_tool,Open Source,langchain_tool,no,BUILD_NEW_MCP,Hackerdogs,OSS,"Get WHOIS information for an IP address. Returns IP registration details, ASN information, network ranges, and ownership data. Use for IP intelligence, network ownership verification, or understanding",,no,https://github.com/hackerdogs/hackerdogs-core,https://github.com/hackerdogs/hackerdogs-core
WebC Get Readability Stats,(none),webc-get-readability-stats-mcp,langchain_tool,Open Source,langchain_tool,no,BUILD_NEW_MCP,Hackerdogs,OSS,"Calculate readability statistics for text. Returns multiple readability metrics including Flesch Reading Ease, Flesch-Kincaid Grade Level, SMOG Index, and others. Use for content assessment, readabili",,no,https://github.com/hackerdogs/hackerdogs-core,https://github.com/hackerdogs/hackerdogs-core
WebC Get Webpage Response,(none),webc-get-webpage-response-mcp,langchain_tool,Open Source,langchain_tool,no,BUILD_NEW_MCP,Hackerdogs,OSS,"Get HTTP response metadata and headers for a webpage. Returns status code, headers, content type, content length, server information, and response time. Use for analyzing HTTP responses, checking serv",,no,https://github.com/hackerdogs/hackerdogs-core,https://github.com/hackerdogs/hackerdogs-core
WebC Ping Service,(none),webc-ping-service-mcp,langchain_tool,Open Source,langchain_tool,no,BUILD_NEW_MCP,Hackerdogs,OSS,"Ping a host to check connectivity. Sends ICMP ping packets and measures response time. Returns ping statistics including round-trip time, packet loss, and host reachability. Use for connectivity testi",,no,https://github.com/hackerdogs/hackerdogs-core,https://github.com/hackerdogs/hackerdogs-core
WebC Remove Stopwords,(none),webc-remove-stopwords-mcp,langchain_tool,Open Source,langchain_tool,no,BUILD_NEW_MCP,Hackerdogs,OSS,"Remove stopwords from text. Filters out common words that carry little meaning (the, a, an, etc.) to focus on important content. Returns cleaned text with stopwords removed. Use for text preprocessing",,no,https://github.com/hackerdogs/hackerdogs-core,https://github.com/hackerdogs/hackerdogs-core
WebC Resolve Domain IPs,(none),webc-resolve-domain-ips-mcp,langchain_tool,Open Source,langchain_tool,no,BUILD_NEW_MCP,Hackerdogs,OSS,"Resolve domain name to IP addresses. Performs DNS A record lookup and returns all IP addresses associated with the domain. Fast and simple DNS resolution. Use for quick IP lookup, DNS verification, or",,no,https://github.com/hackerdogs/hackerdogs-core,https://github.com/hackerdogs/hackerdogs-core
WebC Scan Service,(none),webc-scan-service-mcp,langchain_tool,Open Source,langchain_tool,no,BUILD_NEW_MCP,Hackerdogs,OSS,"Scan a network service (port scan). Checks if a specific port is open on a host. Returns port status, service information, and response details. Use for port scanning, service discovery, or network re",,no,https://github.com/hackerdogs/hackerdogs-core,https://github.com/hackerdogs/hackerdogs-core
WebC Translate Text,(none),webc-translate-text-mcp,langchain_tool,Open Source,langchain_tool,no,BUILD_NEW_MCP,Hackerdogs,OSS,"Translate text from one language to another. Supports automatic source language detection or explicit source/target language specification. Use for translating content, analyzing foreign language text",,no,https://github.com/hackerdogs/hackerdogs-core,https://github.com/hackerdogs/hackerdogs-core
WebC Translate Webpage,(none),webc-translate-webpage-mcp,langchain_tool,Open Source,langchain_tool,no,BUILD_NEW_MCP,Hackerdogs,OSS,"Translate entire webpage content to English. Fetches webpage, extracts text, detects language, and translates to English. Use for analyzing foreign language websites or making content accessible in En",,no,https://github.com/hackerdogs/hackerdogs-core,https://github.com/hackerdogs/hackerdogs-core
WebC Validate Credit Card,(none),webc-validate-credit-card-mcp,langchain_tool,Open Source,langchain_tool,no,BUILD_NEW_MCP,Hackerdogs,OSS,"Validate and analyze credit card numbers. Uses Luhn algorithm for validation and identifies card type (Visa, Mastercard, etc.), issuer, and other metadata. Use for credit card validation, payment proc",,no,https://github.com/hackerdogs/hackerdogs-core,https://github.com/hackerdogs/hackerdogs-core
WhatsMyName,(none),whatsmyname-mcp,langchain_tool,Open Source,langchain_tool,no,BUILD_NEW_MCP,Hackerdogs,OSS,Scan a community-maintained list of websites for username presence using the WhatsMyName dataset. This tool checks profile URLs across many sites and returns LLM-friendly JSON matches. Optional HTML r,"WMN_DATA_URL, WMN_MAX_WORKERS, WMN_REQUEST_TIMEOUT",no,https://github.com/WebBreacher/WhatsMyName,https://github.com/WebBreacher/WhatsMyName
AACT Clinical Trials MCP Server,CTGOV-MCP-DOCKER,ctgov-mcp-docker-mcp,docker,OSINT Tool,mcp_server,yes,COPY_DOCKER_CONFIG,https://github.com/navisbio/aact_mcp,OSS,A Model Context Protocol (MCP) server implementation that provides access to the AACT (Aggregate Analysis of ClinicalTrials.gov https://aact.ctti-clinicaltrials.org/) database using the FastMCP framew,,no,https://github.com/navisbio/aact_mcp,https://aact.ctti-clinicaltrials.org/
Alpha Vantage MCP,alphavantage,alphavantage-mcp,docker,OSINT Tool,mcp_server,yes,COPY_DOCKER_CONFIG,https://github.com/berlinbra/alpha-vantage-mcp?tab=readme-ov-file,OSS,"A Model Context Protocol (MCP) server providing real-time and historical financial data. It offers a standardized interface for stock quotes, company fundamentals (market cap, sector), and technical i",,no,https://github.com/berlinbra/alpha-vantage-mcp?tab=readme-ov-file,https://github.com/berlinbra/alpha-vantage-mcp?tab=readme-ov-file
Alterx MCP,acuvity-mcp-server-alterx,acuvity-mcp-server-alterx-mcp,docker,DNS Security,mcp_server,yes,COPY_DOCKER_CONFIG,https://hub.docker.com/r/acuvity/mcp-server-alterx,OSS,Alterx MCP enables seamless integration of Alterx's domain wordlist generation capabilities into MCP-compatible applications and AI-powered workflow systems. This bridge allows you to leverage Alterx',,no,https://github.com/cyproxio/mcp-for-security/tree/HEAD/alterx-mcp,https://hub.docker.com/r/acuvity/mcp-server-alterx
Amass MCP Server,acuvity-mcp-server-amass,acuvity-mcp-server-amass-mcp,docker,Network Monitoring,mcp_server,yes,COPY_DOCKER_CONFIG,https://hub.docker.com/r/acuvity/mcp-server-amass,OSS,Amass MCP enables seamless integration of Amass's advanced reconnaissance capabilities into MCP-compatible applications and AI-powered workflow systems. This bridge allows you to leverage Amass's comp,,no,https://hub.docker.com/r/acuvity/mcp-server-amass,https://hub.docker.com/r/acuvity/mcp-server-amass
Arjun MCP Server,acuvity-mcp-server-arjun,acuvity-mcp-server-arjun-mcp,docker,Penetration Testing Tool,mcp_server,yes,COPY_DOCKER_CONFIG,https://hub.docker.com/r/acuvity/mcp-server-arjun,OSS,Arjun MCP enables seamless integration of Arjun’s advanced hidden parameter discovery capabilities into MCP-compatible applications and AI-powered workflow systems. This bridge allows you to leverage ,,no,https://github.com/cyproxio/mcp-for-security/tree/HEAD/arjun-mcp,https://hub.docker.com/r/acuvity/mcp-server-arjun
Assetfinder MCP Server,acuvity-mcp-server-assetfinder,acuvity-mcp-server-assetfinder-mcp,docker,DNS Security,mcp_server,yes,COPY_DOCKER_CONFIG,https://hub.docker.com/r/acuvity/mcp-server-assetfinder,OSS,Assetfinder MCP enables seamless integration of Assetfinder’s passive subdomain enumeration capabilities into MCP-compatible applications and AI-powered systems. This allows automated workflows and AI,,no,https://github.com/cyproxio/mcp-for-security/tree/HEAD/assetfinder-mcp,https://hub.docker.com/r/acuvity/mcp-server-assetfinder
Atlas Docs MCP Server,acuvity-mcp-server-atlas-docs,acuvity-mcp-server-atlas-docs-mcp,docker,Audit Tool,mcp_server,yes,COPY_DOCKER_CONFIG,https://hub.docker.com/r/acuvity/mcp-server-atlas-docs,OSS,"Atlas Docs MCP server:  Provides technical documentation for libraries and frameworks Processes the official docs into a clean markdown version for LLM consumption Is easy to set up with Cursor, Cline",,no,https://github.com/CartographAI/atlas-docs-mcp,https://hub.docker.com/r/acuvity/mcp-server-atlas-docs
Atlassian MCP Server,acuvity-mcp-server-atlassian,acuvity-mcp-server-atlassian-mcp,docker,Collaboration,mcp_server,yes,COPY_DOCKER_CONFIG,https://hub.docker.com/r/acuvity/mcp-server-atlassian,Commercial,Integrates AI tools for Jira and Confluence tasks and automation. Model Context Protocol (MCP) server for Atlassian products (Confluence and Jira). Supports both Cloud and Server/Data Center deploymen,,no,https://github.com/sooperset/mcp-atlassian,https://hub.docker.com/r/acuvity/mcp-server-atlassian
Bing Search MCP server,acuvity-mcp-server-bing-search,acuvity-mcp-server-bing-search-mcp,docker,Web Search,mcp_server,yes,COPY_DOCKER_CONFIG,https://hub.docker.com/r/acuvity/mcp-server-bing-search,Commercial,"A Model Context Protocol (MCP) server for Microsoft Bing Search API integration, allowing AI assistants to perform web, news, and image searches.  Features Web search for general information News sear",,no,https://github.com/leehanchung/bing-search-mcp,https://hub.docker.com/r/acuvity/mcp-server-bing-search
Brave Search MCP Server,acuvity-mcp-server-brave-search,acuvity-mcp-server-brave-search-mcp,docker,Web Search,mcp_server,yes,COPY_DOCKER_CONFIG,https://hub.docker.com/r/acuvity/mcp-server-brave-search,Commercial,MCP server for Brave Search API integration,,no,https://hub.docker.com/r/acuvity/mcp-server-brave-search,https://hub.docker.com/r/acuvity/mcp-server-brave-search
Calculator MCP Server,acuvity-mcp-server-calculator,acuvity-mcp-server-calculator-mcp,docker,Web Search,mcp_server,yes,COPY_DOCKER_CONFIG,https://hub.docker.com/r/acuvity/mcp-server-calculator,OSS,A Model Context Protocol server for calculating. This server enables LLMs to use calculator for precise numerical calculations.  Available Tools calculate - Calculates/evaluates the given expression. ,,no,https://hub.docker.com/r/acuvity/mcp-server-calculator,https://hub.docker.com/r/acuvity/mcp-server-calculator
Chroma MCP Server,acuvity-mcp-server-chroma,acuvity-mcp-server-chroma-mcp,docker,Audit Tool,mcp_server,yes,COPY_DOCKER_CONFIG,Chroma,OSS,"This server provides data retrieval capabilities powered by Chroma vector database, enabling AI models to create collections over generated data and user inputs, and retrieve that data using vector se",,no,https://github.com/chroma-core/chroma-mcp,https://hub.docker.com/r/acuvity/mcp-server-chroma
Code Runner MCP Server,mcp-server-code-runner,mcp-server-code-runner-mcp,docker,Sandbox,mcp_server,yes,COPY_DOCKER_CONFIG,https://github.com/formulahendry/mcp-server-code-runner,OSS,"MCP Server for running code snippet and show the result.  It supports running multiple programming languages: JavaScript, PHP, Python, Perl, Perl 6, Ruby, Go, Lua, Groovy, PowerShell, BAT/CMD, BASH/SH",,no,https://github.com/formulahendry/mcp-server-code-runner,https://github.com/formulahendry/mcp-server-code-runner
Cortex MCP server,cortex,cortex-mcp,docker,OSINT Tool,mcp_server,yes,COPY_DOCKER_CONFIG,https://github.com/gbrigandi/mcp-server-cortex,OSS,"A security orchestration server that provides a unified interface for multiple threat intelligence analyzers. It allows AI agents to submit IPs to AbuseIPDB, analyze files/URLs with VirusTotal, and pe",,no,https://github.com/gbrigandi/mcp-server-cortex,https://github.com/gbrigandi/mcp-server-cortex
Crtsh MCP Server,acuvity-mcp-server-crtsh,acuvity-mcp-server-crtsh-mcp,docker,Penetration Testing Tool,mcp_server,yes,COPY_DOCKER_CONFIG,https://hub.docker.com/r/acuvity/mcp-server-crtsh,OSS,Subdomain discovery tool using SSL certificate transparency logs via crt.sh.  Certificate Search MCP enables seamless integration of crt.sh's capability to discover subdomains into MCP-compatible appl,,no,https://github.com/cyproxio/mcp-for-security/tree/HEAD/crtsh-mcp,https://hub.docker.com/r/acuvity/mcp-server-crtsh
Crunchbase MCP Server,crunchbase,crunchbase-mcp,docker,OSINT Tool,mcp_server,yes,COPY_DOCKER_CONFIG,Cyreslab-AI,OSS,"A Model Context Protocol (MCP) server that connects AI assistants to Crunchbase data. It enables users to search for companies, retrieve detailed company profiles, access funding round information, tr",,no,https://github.com/Cyreslab-AI/crunchbase-mcp-server,https://github.com/Cyreslab-AI/crunchbase-mcp-server
Docker MCP server,acuvity-mcp-server-docker,acuvity-mcp-server-docker-mcp,docker,Penetration Testing Tool,mcp_server,yes,COPY_DOCKER_CONFIG,https://hub.docker.com/r/acuvity/mcp-server-docker,OSS,An MCP server for managing Docker with natural language!  What can it do? Compose containers with natural language Introspect & debug running containers Manage persistent data with Docker volumes  Too,,no,https://github.com/ckreiling/mcp-server-docker,https://hub.docker.com/r/acuvity/mcp-server-docker
DuckDuckGo MCP server,duckduckgo,duckduckgo-mcp,docker,Web Search,mcp_server,yes,COPY_DOCKER_CONFIG,https://hub.docker.com/mcp/server/duckduckgo/overview,OSS,"A Model Context Protocol (MCP) server that provides web search capabilities through DuckDuckGo, with additional features for content fetching and parsing.  DuckDuckGo Server MCP server Features Web Se",,no,https://github.com/nickclyde/duckduckgo-mcp-server,https://hub.docker.com/mcp/server/duckduckgo/overview
DuckDuckGo Search MCP Server (Acuvity),acuvity-mcp-server-duckduckgo,acuvity-mcp-server-duckduckgo-mcp,docker,Web Search,mcp_server,yes,COPY_DOCKER_CONFIG,https://hub.docker.com/r/acuvity/mcp-server-duckduckgo,OSS,"A Model Context Protocol (MCP) server that provides web search capabilities through DuckDuckGo, with additional features for content fetching and parsing.  DuckDuckGo Server MCP server Features Web Se",,no,https://hub.docker.com/r/acuvity/mcp-server-duckduckgo,https://hub.docker.com/r/acuvity/mcp-server-duckduckgo
Edgar Tools MCP Server,edgartools-mcp-server,edgartools-mcp-server-mcp,docker,OSINT Tool,mcp_server,yes,COPY_DOCKER_CONFIG,https://github.com/dgunning/edgartools,OSS,"EdgarTools supports all SEC form types including 10-K annual reports, 10-Q quarterly filings, 8-K current reports, 13F institutional holdings, Form 4 insider transactions, proxy statements (DEF 14A), ",,no,https://github.com/dgunning/edgartools,https://github.com/dgunning/edgartools
EduData Mcp Server,edu-data,edu-data-mcp,docker,OSINT Tool,mcp_server,yes,COPY_DOCKER_CONFIG,https://github.com/hackerdogs-ai/osint-dhruv/blob/main/EduData/DESCRIPTION.md,OSS,Overview edu-data-mcp-server is a Model Context Protocol (MCP) server that provides access to the Urban Institute's Education Data API. It enables AI assistants to query school and district enrollment,,no,https://github.com/hackerdogs-ai/osint-dhruv/blob/main/EduData/DESCRIPTION.md,https://github.com/hackerdogs-ai/osint-dhruv/blob/main/EduData/DESCRIPTION.md
Eleven Labs MCP Server,acuvity-mcp-server-elevenlabs,acuvity-mcp-server-elevenlabs-mcp,docker,Phishing Simulation,mcp_server,yes,COPY_DOCKER_CONFIG,https://hub.docker.com/r/acuvity/mcp-server-elevenlabs,Commercial,"Official ElevenLabs Model Context Protocol (MCP) server that enables interaction with powerful Text to Speech and audio processing APIs.   Example Prompts:  ""Generate an AI agent that speaks like a fi",,no,https://github.com/elevenlabs/elevenlabs-mcp,https://github.com/elevenlabs/elevenlabs-mcp
Everything Wrong MCP Server,acuvity-mcp-server-everything-wrong,acuvity-mcp-server-everything-wrong-mcp,docker,Security Awareness Platform,mcp_server,yes,COPY_DOCKER_CONFIG,https://hub.docker.com/r/acuvity/mcp-server-everything-wrong,OSS,"A demonstration Model Context Protocol (MCP) server that exposes a variety of “tools”—some benign, some intentionally misbehaving. Use this server to explore edge-cases in tool registration, invocatio",,no,https://hub.docker.com/r/acuvity/mcp-server-everything-wrong,https://hub.docker.com/r/acuvity/mcp-server-everything-wrong
Fetch Mcp Server,acuvity-mcp-server-fetch,acuvity-mcp-server-fetch-mcp,docker,Web Search,mcp_server,yes,COPY_DOCKER_CONFIG,https://hub.docker.com/r/acuvity/mcp-server-fetch,OSS,"Fetch MCP Server A Model Context Protocol server that provides web content fetching capabilities. This server enables LLMs to retrieve and process content from web pages, converting HTML to markdown f",,no,https://hub.docker.com/r/acuvity/mcp-server-fetch,https://hub.docker.com/r/acuvity/mcp-server-fetch
FFUF MCP Server,acuvity-mcp-server-ffuf,acuvity-mcp-server-ffuf-mcp,docker,Penetration Testing Tool,mcp_server,yes,COPY_DOCKER_CONFIG,https://hub.docker.com/r/acuvity/mcp-server-ffuf,OSS,FFUF MCP enables seamless integration of FFUF's powerful web fuzzing capabilities into MCP-compatible applications and AI-powered workflow systems. This bridge allows you to leverage FFUF functionalit,,no,https://github.com/cyproxio/mcp-for-security/tree/e7392fa7f64ac5848259dac2379bee36aba56eb5/ffuf-mcp,https://hub.docker.com/r/acuvity/mcp-server-ffuf
Financial Datasets MCP,financial-datasets,financial-datasets-mcp,docker,OSINT Tool,mcp_server,yes,COPY_DOCKER_CONFIG,,OSS,"A comprehensive financial data server that connects AI assistants to real-time and historical stock market intelligence. It provides specific tools to retrieve company fundamentals (income statements,",,no,https://github.com/financial-datasets/mcp-server,https://github.com/financial-datasets/mcp-server
