tool_name,server_name,mcp_server_slug,type,tool_type,service_type,is_mcp_server,action,vendor,category,description,env_keys,has_existing_mcp,source_code_link,documentation_url
Firecrawl MCP Server,acuvity-mcp-server-firecrawl,acuvity-mcp-server-firecrawl-mcp,docker,Web Search,mcp_server,yes,COPY_DOCKER_CONFIG,https://hub.docker.com/r/acuvity/mcp-server-firecrawl,Commercial,A Model Context Protocol (MCP) server implementation that integrates with Firecrawl for web scraping capabilities.,,no,https://github.com/firecrawl/firecrawl-mcp-server,https://github.com/firecrawl/firecrawl-mcp-server
Flights MCP,flights,flights-mcp,docker,OSINT Tool,mcp_server,yes,COPY_DOCKER_CONFIG,maratsarbasov,OSS,"A Model Context Protocol (MCP) server that provides flight search capabilities by integrating with the Aviasales Flight Search API. It allows AI agents to search for flights (one-way, round-trip, mult",,no,https://github.com/maratsarbasov/flights-mcp,https://github.com/maratsarbasov/flights-mcp
FRED MCP SERVER,fred-mcp,fred-mcp,docker,OSINT Tool,mcp_server,yes,COPY_DOCKER_CONFIG,https://github.com/stefanoamorelli/fred-mcp-server?tab=readme-ov-file,OSS,"A Model Context Protocol (MCP) server providing structured access to over 800,000 economic time series from the Federal Reserve Economic Data (FRED) database. It enables AI agents to browse categories",,no,https://github.com/stefanoamorelli/fred-mcp-server?tab=readme-ov-file,https://github.com/stefanoamorelli/fred-mcp-server?tab=readme-ov-file
Google Maps MCP Server,acuvity-mcp-server-google-maps,acuvity-mcp-server-google-maps-mcp,docker,OSINT Tool,mcp_server,yes,COPY_DOCKER_CONFIG,https://hub.docker.com/r/acuvity/mcp-server-google-maps,Commercial,MCP server for using the Google Maps API,,no,https://hub.docker.com/r/acuvity/mcp-server-google-maps,https://hub.docker.com/r/acuvity/mcp-server-google-maps
Grafana MCP Server,acuvity-mcp-server-grafana,acuvity-mcp-server-grafana-mcp,docker,Cloud Security Posture Management (CSPM),mcp_server,yes,COPY_DOCKER_CONFIG,https://hub.docker.com/r/acuvity/mcp-server-grafana,Hybrid,The Grafana MCP Server MCP Server provides access to your Grafana instance and the surrounding ecosystem.,,no,https://github.com/grafana/mcp-grafana,https://hub.docker.com/r/acuvity/mcp-server-grafana
Harness MCP Server,acuvity-mcp-server-harness,acuvity-mcp-server-harness-mcp,docker,Code Analysis Tool,mcp_server,yes,COPY_DOCKER_CONFIG,https://hub.docker.com/r/acuvity/mcp-server-harness,Commercial,"The Harness MCP Server is a Model Context Protocol (MCP) server that provides seamless integration with Harness APIs, enabling advanced automation and interaction capabilities for developers and tools",,no,https://github.com/harness/mcp-server,https://hub.docker.com/r/acuvity/mcp-server-harness
httpx MCP,acuvity-mcp-server-httpx,acuvity-mcp-server-httpx-mcp,docker,Web Security,mcp_server,yes,COPY_DOCKER_CONFIG,https://hub.docker.com/r/acuvity/mcp-server-httpx,OSS,httpx MCP enables seamless integration of httpx's capabilities to scan and analyze HTTP/HTTPS services into MCP-compatible applications and AI-powered workflow systems. This bridge allows you to detec,,no,https://github.com/cyproxio/mcp-for-security/tree/HEAD/httpx-mcp,https://hub.docker.com/r/acuvity/mcp-server-httpx
Hyperbrowser MCP Server,acuvity-mcp-server-hyperbrowser,acuvity-mcp-server-hyperbrowser-mcp,docker,Web Search,mcp_server,yes,COPY_DOCKER_CONFIG,https://hub.docker.com/r/acuvity/mcp-server-hyperbrowser,OSS,"This is Hyperbrowser's Model Context Protocol (MCP) Server. It provides various tools to scrape, extract structured data, and crawl webpages. It also provides easy access to general purpose browser ag",,no,https://hub.docker.com/r/acuvity/mcp-server-hyperbrowser,https://hub.docker.com/r/acuvity/mcp-server-hyperbrowser
Kagi Search MCP Server,acuvity-mcp-server-kagisearch,acuvity-mcp-server-kagisearch-mcp,docker,Web Search,mcp_server,yes,COPY_DOCKER_CONFIG,https://hub.docker.com/r/acuvity/mcp-server-kagisearch,Commercial,MCP server for search queries and video summarization using Kagi,,no,https://github.com/kagisearch/kagimcp,https://hub.docker.com/r/acuvity/mcp-server-kagisearch
Katana MCP Server,acuvity-mcp-server-katana,acuvity-mcp-server-katana-mcp,docker,OSINT Tool,mcp_server,yes,COPY_DOCKER_CONFIG,https://hub.docker.com/r/acuvity/mcp-server-katana,OSS,Katana MCP enables seamless integration of Katana’s advanced crawling and endpoint discovery capabilities into MCP-compatible applications and AI-powered systems. This allows automated workflows and A,,no,https://github.com/cyproxio/mcp-for-security/tree/HEAD/katana-mcp,https://hub.docker.com/r/acuvity/mcp-server-katana
Mapbox MCP Server,MapboxServer,mapboxserver-mcp,docker,OSINT Tool,mcp_server,yes,COPY_DOCKER_CONFIG,Mapbox,OSS,The Mapbox MCP Server transforms any AI agent or application into a geospatially-aware system by providing seamless access to Mapbox's comprehensive location intelligence platform.  It is a location i,,no,https://github.com/mapbox/mcp-server,https://github.com/mapbox/mcp-server/blob/main/docs/claude-desktop-setup.md
Marine Traffic MCP,marinetraffic,marinetraffic-mcp,docker,OSINT Tool,mcp_server,yes,COPY_DOCKER_CONFIG,MCP-Mirror,OSS,"A Model Context Protocol (MCP) server that connects AI assistants to the MarineTraffic API. It provides real-time vessel tracking, detailed vessel information, and search capabilities, enabling users ",,no,https://github.com/MCP-Mirror/Cyreslab-AI_marinetraffic-mcp-server,https://github.com/MCP-Mirror/Cyreslab-AI_marinetraffic-mcp-server
Masscan MCP,acuvity-mcp-server-masscan,acuvity-mcp-server-masscan-mcp,docker,DNS Security,mcp_server,yes,COPY_DOCKER_CONFIG,https://hub.docker.com/r/acuvity/mcp-server-masscan,OSS,Masscan MCP enables seamless integration of Masscan's high-speed network scanning capabilities into MCP-compatible applications and AI-powered workflow systems. This bridge allows you to leverage Mass,,no,https://hub.docker.com/r/acuvity/mcp-server-masscan,https://hub.docker.com/r/acuvity/mcp-server-masscan
MCP Server Everything,acuvity-mcp-server-everything,acuvity-mcp-server-everything-mcp,docker,Audit Tool,mcp_server,yes,COPY_DOCKER_CONFIG,https://hub.docker.com/r/acuvity/mcp-server-everything,OSS,MCP server that exercises all the features of the MCP protocol,,no,https://hub.docker.com/r/acuvity/mcp-server-everything,https://hub.docker.com/r/acuvity/mcp-server-everything
Microsoft Azure MCP Server,acuvity-mcp-server-azure,acuvity-mcp-server-azure-mcp,docker,Cloud Security Posture Management (CSPM),mcp_server,yes,COPY_DOCKER_CONFIG,https://hub.docker.com/r/acuvity/mcp-server-azure,Commercial,Integrates AI agents with Azure services for enhanced functionality.,,no,https://hub.docker.com/r/acuvity/mcp-server-azure,https://hub.docker.com/r/acuvity/mcp-server-azure
Microsoft Graph MCP Server,acuvity-mcp-server-microsoft-graph,acuvity-mcp-server-microsoft-graph-mcp,docker,Identity Provider (IdP),mcp_server,yes,COPY_DOCKER_CONFIG,https://github.com/acuvity/mcp-server-microsoft-graph,OSS,"Connect to microsoft graph API to get applications, sites users and more.",,no,https://github.com/acuvity/mcp-server-microsoft-graph,https://github.com/acuvity/mcp-server-microsoft-graph
Minio AIStor MCP Server (Official),aistor,aistor-mcp,docker,Disaster Recovery Tool,mcp_server,yes,COPY_DOCKER_CONFIG,Minio,OSS,"The official Model Context Protocol server for MinIO’s exabyte-scale object storage. It provides AI agents with a natural language interface to manage storage clusters, including creating buckets, upl",,no,https://github.com/minio/mcp-server-aistor,https://github.com/minio/mcp-server-aistor
N2YO MCP,n2yo,n2yo-mcp,docker,OSINT Tool,mcp_server,yes,COPY_DOCKER_CONFIG,MaxwellCalkin,OSS,"A Model Context Protocol (MCP) server that connects AI assistants to the N2YO.com API for real-time satellite tracking. It enables users to perform natural language queries about satellite locations, ",,no,https://github.com/MaxwellCalkin/N2YO-MCP,https://github.com/MaxwellCalkin/N2YO-MCP
NetUtils,netutils,netutils-mcp,docker,Network Segmentation,mcp_server,yes,COPY_DOCKER_CONFIG,https://github.com/patrickdappollonio/mcp-netutils,OSS,"A comprehensive network and domain analysis toolkit for AI assistants. It provides a suite of tools for DNS exploration (A, AAAA, MX, TXT records), WHOIS registration lookups, and deep connectivity te",,no,https://github.com/patrickdappollonio/mcp-domaintools,https://github.com/patrickdappollonio/mcp-domaintools
Nmap MCP Server,acuvity-mcp-server-nmap,acuvity-mcp-server-nmap-mcp,docker,Network Monitoring,mcp_server,yes,COPY_DOCKER_CONFIG,https://hub.docker.com/r/acuvity/mcp-server-nmap,OSS,Nmap MCP enables seamless integration of Nmap's comprehensive network scanning and security auditing capabilities into MCP-compatible applications and AI-powered workflow systems. This bridge allows y,,no,https://github.com/cyproxio/mcp-for-security/tree/HEAD/nmap-mcp,https://hub.docker.com/r/acuvity/mcp-server-nmap
Notion MCP Server,acuvity-mcp-server-notion,acuvity-mcp-server-notion-mcp,docker,Collaboration,mcp_server,yes,COPY_DOCKER_CONFIG,https://hub.docker.com/r/acuvity/mcp-server-notion,Commercial,"Notion MCP is our hosted server that gives AI tools secure access to your Notion workspace.  Generate documentation — Generate PRDs, tech specs, and architecture docs from your research and project da",,no,https://github.com/makenotion/notion-mcp-server,https://hub.docker.com/r/acuvity/mcp-server-notion
Nuclei MCP Server,acuvity-mcp-server-nuclei,acuvity-mcp-server-nuclei-mcp,docker,DAST,mcp_server,yes,COPY_DOCKER_CONFIG,https://hub.docker.com/r/acuvity/mcp-server-nuclei,OSS,"Scan target for vulnerabilities using Nuclei templates. Nuclei is a fast vulnerability scanner based on templates. It can detect CVEs, misconfigurations, and security issues. Supports filtering by sev",,no,https://github.com/cyproxio/mcp-for-security/tree/HEAD/nuclei-mcp,https://hub.docker.com/r/acuvity/mcp-server-nuclei
OCR MCP Server,ocr,ocr-mcp,docker,MCP Server,mcp_server,yes,COPY_DOCKER_CONFIG,Hackerdogs,OSS,"MCP server for extracting text from images using Tesseract OCR. Supports local files, URLs, and base64-encoded image data. Provides perform_ocr and get_supported_languages tools. Runs in isolated Dock",,no,https://pypi.org/project/mcp-ocr/,https://pypi.org/project/mcp-ocr/
Open Legal Compliance MCP,open-legal,open-legal-mcp,docker,OSINT Tool,mcp_server,yes,COPY_DOCKER_CONFIG,TCoder920x,OSS,"Based on the README.md for the repository TCoder920x/open-legal-compliance-mcp, here is the text for the description field:  Description: A Model Context Protocol (MCP) server that provides legal comp",,no,https://github.com/TCoder920x/open-legal-compliance-mcp,https://github.com/TCoder920x/open-legal-compliance-mcp
OpenCV MCP Server,opencv-mcp-server,opencv-mcp-server-mcp,docker,OSINT Tool,mcp_server,yes,COPY_DOCKER_CONFIG,Hackerdogs,OSS,OpenCV MCP Server is a Python package that provides OpenCV's image and video processing capabilities through the Model Context Protocol (MCP). This allows AI assistants and language models to access p,,no,https://github.com/dynamicdeploy/opencv-mcp-server,https://github.com/dynamicdeploy/opencv-mcp-server
OSHP MCP Server,acuvity-mcp-server-oshp,acuvity-mcp-server-oshp-mcp,docker,DAST,mcp_server,yes,COPY_DOCKER_CONFIG,https://hub.docker.com/r/acuvity/mcp-server-oshp,OSS,Analyzes HTTP response headers against OWASP security standards with recommendations  The OWASP Secure Headers Project (OSHP) provides information on HTTP response headers to increase the security of ,,no,https://github.com/acuvity/mcp-servers-registry/blob/main/mcp-server-oshp/docker/Dockerfile,https://hub.docker.com/r/acuvity/mcp-server-oshp
PageSpeed MCP Server,pagespeed,pagespeed-mcp,docker,Forensics Tool,mcp_server,yes,COPY_DOCKER_CONFIG,https://github.com/MCP-Mirror/PhialsBasement_Pagespeed-MCP-Server,OSS,"A Model Context Protocol (MCP) server that extends AI assistant capabilities with PageSpeed Insights functionality. This server acts as a bridge between AI models and Google's PageSpeed Insights API, ",,no,https://github.com/MCP-Mirror/PhialsBasement_Pagespeed-MCP-Server,https://github.com/MCP-Mirror/PhialsBasement_Pagespeed-MCP-Server
PDF Reader MCP Server (Sylphx),pdf-reader,pdf-reader-mcp,docker,MCP Server,mcp_server,yes,COPY_DOCKER_CONFIG,Sylphx,OSS,MCP server for reading and extracting text from PDF files via URLs. Uses @sylphx/pdf-reader-mcp npm package. Supports PDF URLs via sources array format. Provides read_pdf tool that accepts sources par,,no,https://www.npmjs.com/package/@sylphx/pdf-reader-mcp,https://www.npmjs.com/package/@sylphx/pdf-reader-mcp
PentestAgent MCP,pentest-agent,pentest-agent-mcp,docker,OSINT Tool,mcp_server,yes,COPY_DOCKER_CONFIG,0xSojalSec,OSS,An all-in-one offensive security toolbox and AI agent built on the Model Context Protocol (MCP). It acts as a comprehensive Red Team assistant that integrates a wide range of security tools to perform,,no,https://github.com/0xSojalSec/PentestAgent,https://github.com/0xSojalSec/PentestAgent
Playwright MCP Server,acuvity-mcp-server-playwright,acuvity-mcp-server-playwright-mcp,docker,Web Search,mcp_server,yes,COPY_DOCKER_CONFIG,https://hub.docker.com/r/acuvity/mcp-server-playwright,OSS,"A Model Context Protocol (MCP) server that provides browser automation capabilities using Playwright. This server enables LLMs to interact with web pages through structured accessibility snapshots, by",,no,https://hub.docker.com/r/acuvity/mcp-server-playwright,https://hub.docker.com/r/acuvity/mcp-server-playwright
Polygon MCP server,polygon,polygon-mcp,docker,OSINT Tool,mcp_server,yes,COPY_DOCKER_CONFIG,https://github.com/jwaresolutions/polygon-mcp-server,OSS,Polygon MCP Server A Model Context Protocol (MCP) server that provides tools for interacting with the Polygon.io API for market data. A financial market data server that connects AI assistants to the ,,no,https://github.com/jwaresolutions/polygon-mcp-server,https://github.com/jwaresolutions/polygon-mcp-server
PubMed MCP,pubmed,pubmed-mcp,docker,OSINT Tool,mcp_server,yes,COPY_DOCKER_CONFIG,chrismannina,OSS,"A Model Context Protocol (MCP) server that enables AI assistants to search and analyze PubMed medical literature with advanced filtering, citations, and research tools. It allows for complex searches ",,no,https://github.com/chrismannina/pubmed-mcp,https://github.com/chrismannina/pubmed-mcp
Reddit MCP Server,reddit_mcp_server,reddit-mcp-server-mcp,docker,Web Search,mcp_server,yes,COPY_DOCKER_CONFIG,https://github.com/KrishnaRandad2023/mcp-reddit,OSS,A comprehensive Model Context Protocol (MCP) server for Reddit integration. This server enables AI agents to interact with Reddit programmatically through a standardized interface. A comprehensive int,,no,https://github.com/KrishnaRandad2023/mcp-reddit,https://github.com/KrishnaRandad2023/mcp-reddit
RSS MCP Server,rss-mcp,rss-mcp,docker,Web Search,mcp_server,yes,COPY_DOCKER_CONFIG,Hackerdogs,OSS,"This is a Model Context Protocol (MCP) server built with TypeScript. It provides a versatile tool to fetch and parse any standard RSS/Atom feed, and also includes special support for RSSHub feeds. Wit",,no,https://github.com/veithly/rss-mcp,https://github.com/veithly/rss-mcp
Scan URL MCP server,scan-url,scan-url-mcp,docker,OSINT Tool,mcp_server,yes,COPY_DOCKER_CONFIG,hackerdogs,Commercial,An enhanced security reconnaissance server that integrates with the urlscan.io API. It enables AI assistants to perform deep web analysis and OSINT investigations without visiting potentially maliciou,,no,,
Scout Suite MCP,acuvity-mcp-server-scoutsuite,acuvity-mcp-server-scoutsuite-mcp,docker,Cloud Security Posture Management (CSPM),mcp_server,yes,COPY_DOCKER_CONFIG,https://hub.docker.com/r/acuvity/mcp-server-scoutsuite,OSS,"Scout Suite MCP enables automated security auditing of cloud environments (AWS, Azure, GCP) using Scout Suite’s powerful capabilities, accessible through the standardized MCP interface. It allows AI a",,no,https://hub.docker.com/r/acuvity/mcp-server-scoutsuite,https://hub.docker.com/r/acuvity/mcp-server-scoutsuite
Scrapezy MCP Server,acuvity-mcp-server-scrapezy,acuvity-mcp-server-scrapezy-mcp,docker,Web Search,mcp_server,yes,COPY_DOCKER_CONFIG,https://hub.docker.com/r/acuvity/mcp-server-scrapezy,Commercial,A Model Context Protocol server for Scrapezy that enables AI models to extract structured data from websites.  Features Tools extract_structured_data - Extract structured data from a website Takes URL,,no,https://hub.docker.com/r/acuvity/mcp-server-scrapezy,https://github.com/Scrapezy/mcp
SEC Edgar MCP Server,sec-edgar-mcp,sec-edgar-mcp,docker,Web Search,mcp_server,yes,COPY_DOCKER_CONFIG,https://github.com/stefanoamorelli/sec-edgar-mcp,OSS,"MCP server for accessing SEC EDGAR filings. Connects AI assistants to company filings, financial statements, and insider trading data with exact numeric precision. A high-precision financial research ",,no,https://github.com/stefanoamorelli/sec-edgar-mcp,https://github.com/stefanoamorelli/sec-edgar-mcp
Sentry MCP Server,acuvity-mcp-server-sentry,acuvity-mcp-server-sentry-mcp,docker,Code Analysis Tool,mcp_server,yes,COPY_DOCKER_CONFIG,https://hub.docker.com/r/acuvity/mcp-server-sentry,Commercial,Retrieving and analyzing application issues from Sentry.io.,,no,https://hub.docker.com/r/acuvity/mcp-server-sentry,https://hub.docker.com/r/acuvity/mcp-server-sentry
Shodan MCP,shodan,shodan-mcp,docker,OSINT Tool,mcp_server,yes,COPY_DOCKER_CONFIG,ADEOSec,OSS,"A dual-purpose cybersecurity server that combines Shodan’s internet-scale device intelligence with VirusTotal’s reputation analysis. It allows AI agents to perform deep infrastructure audits, identify",,no,https://github.com/ADEOSec/mcp-shodan,https://github.com/ADEOSec/mcp-shodan
shuffledns MCP Server,acuvity-mcp-server-shuffledns,acuvity-mcp-server-shuffledns-mcp,docker,Penetration Testing Tool,mcp_server,yes,COPY_DOCKER_CONFIG,https://hub.docker.com/r/acuvity/mcp-server-shuffledns,OSS,"shuffledns MCP enables seamless integration of shuffledns’s capabilities for DNS brute forcing, DNS resolving, and filtering into MCP-compatible applications and AI-driven workflow systems. This bridg",,no,https://github.com/cyproxio/mcp-for-security/tree/HEAD/shuffledns-mcp,https://hub.docker.com/r/acuvity/mcp-server-shuffledns
Slack MCP Server,slack,slack-mcp,docker,OSINT Tool,mcp_server,yes,COPY_DOCKER_CONFIG,korotovsky,OSS,"A specialized communication server for Slack that operates in a ""Stealth Mode,"" allowing AI agents to interact with channels and threads using user tokens (simulating human behavior) or standard bot O","SLACK_MCP_XOXC_TOKEN, SLACK_MCP_XOXD_TOKEN",no,https://github.com/korotovsky/slack-mcp-server,https://github.com/korotovsky/slack-mcp-server
Slack MCP Server,acuvity-mcp-server-slack,acuvity-mcp-server-slack-mcp,docker,Collaboration,mcp_server,yes,COPY_DOCKER_CONFIG,https://hub.docker.com/r/acuvity/mcp-server-slack,Commercial,MCP server for interacting with Slack,,no,https://hub.docker.com/r/acuvity/mcp-server-slack,https://hub.docker.com/r/acuvity/mcp-server-slack
Smuggler MCP Server,acuvity-mcp-server-smuggler,acuvity-mcp-server-smuggler-mcp,docker,Identity Provider (IdP),mcp_server,yes,COPY_DOCKER_CONFIG,https://hub.docker.com/r/acuvity/mcp-server-smuggler,OSS,Smuggler MCP allows you to use the Smuggler HTTP Request Smuggling testing tool through the MCP protocol. This integration offers Smuggler's capabilities to automated security testing processes or AI ,,no,https://github.com/cyproxio/mcp-for-security/tree/HEAD/smuggler-mcp,https://hub.docker.com/r/acuvity/mcp-server-smuggler
SQLMAP MCP Server,acuvity-mcp-server-sqlmap,acuvity-mcp-server-sqlmap-mcp,docker,Penetration Testing Tool,mcp_server,yes,COPY_DOCKER_CONFIG,https://hub.docker.com/r/acuvity/mcp-server-sqlmap,OSS,SQLMap SQL injection detection and exploitation tool bridge for MCP ecosystem.  SQLMap MCP enables seamless integration of SQLMap's powerful SQL injection testing capabilities into MCP-compatible appl,,no,https://hub.docker.com/r/acuvity/mcp-server-sqlmap,https://hub.docker.com/r/acuvity/mcp-server-sqlmap
SSLScan MCP,acuvity-mcp-server-sslscan,acuvity-mcp-server-sslscan-mcp,docker,Penetration Testing Tool,mcp_server,yes,COPY_DOCKER_CONFIG,https://hub.docker.com/r/acuvity/mcp-server-sslscan,OSS,SSLScan MCP enables seamless integration of SSLScan's SSL/TLS assessment capabilities into MCP-compatible applications and AI-powered workflow systems. This bridge allows you to leverage SSLScan funct,,no,https://hub.docker.com/r/acuvity/mcp-server-sslscan,https://hub.docker.com/r/acuvity/mcp-server-sslscan
Trivy Security MCP server,trivy-security,trivy-security-mcp,docker,Risk Assessment Tool,mcp_server,yes,COPY_DOCKER_CONFIG,aquasecurity,Commercial,A Model Context Protocol (MCP) server that integrates the Trivy security scanner. It enables AI assistants to perform automated security assessments by scanning container images and remote Git reposit,,no,https://github.com/aquasecurity/trivy,https://github.com/aquasecurity/trivy
USGS MCP,earthquake,earthquake-mcp,docker,OSINT Tool,mcp_server,yes,COPY_DOCKER_CONFIG,ruby0606,OSS,"A comprehensive Model Context Protocol (MCP) server that integrates data from IRIS, USGS, and GNSS/GPS networks to provide global earthquake monitoring and analysis. It enables real-time tracking of s",,no,https://github.com/ruby0606/mcp-earthquake-server,https://github.com/ruby0606/mcp-earthquake-server
Waybackurls MCP,acuvity-mcp-server-waybackurls,acuvity-mcp-server-waybackurls-mcp,docker,Web Search,mcp_server,yes,COPY_DOCKER_CONFIG,https://hub.docker.com/r/acuvity/mcp-server-waybackurls,OSS,Retrieves historical URLs from the Wayback Machine for reconnaissance and security testing.  Waybackurls MCP enables seamless integration of Waybackurls' capability to discover historical endpoints in,,no,https://github.com/cyproxio/mcp-for-security/tree/HEAD/waybackurls-mcp,https://hub.docker.com/r/acuvity/mcp-server-waybackurls
Wiremcp,wiremcp,wiremcp-mcp,docker,OSINT Tool,mcp_server,yes,COPY_DOCKER_CONFIG,0xKoda,OSS,"A Model Context Protocol (MCP) server that connects AI assistants to Wireshark (via tshark) for real-time network traffic analysis. It empowers LLMs to capture live packets, analyze protocol statistic",,no,https://github.com/0xKoda/WireMCP,https://github.com/0xKoda/WireMCP
World Bank MCP,world-bank,world-bank-mcp,docker,OSINT Tool,mcp_server,yes,COPY_DOCKER_CONFIG,anshumax,OSS,"A Model Context Protocol (MCP) server that enables interaction with the open World Bank data API. It allows AI assistants to access global economic data, including listing available countries and indi",,no,https://github.com/anshumax/world_bank_mcp_server,https://github.com/anshumax/world_bank_mcp_server
Yahoo Finance MCP SERVER,yfmcp,yfmcp-mcp,docker,OSINT Tool,mcp_server,yes,COPY_DOCKER_CONFIG,https://github.com/narumiruna/yfinance-mcp,OSS,"Yahoo Finance MCP Server A simple MCP server for Yahoo Finance using yfinance. This server provides a set of tools to fetch stock data, news, and other financial information. A financial intelligence ",,no,https://github.com/narumiruna/yfinance-mcp,https://github.com/narumiruna/yfinance-mcp
YaraFlux MCP server,yaraflux-mcp-server,yaraflux-mcp-server-mcp,docker,OSINT Tool,mcp_server,yes,COPY_DOCKER_CONFIG,ThreatFlux,OSS,"A YARA-based Model Context Protocol (MCP) server that integrates with AI assistants to perform automated malware scanning and threat analysis. A security-focused server that integrates YARA, the indus","DEBUG, ADMIN_PASSWORD, JWT_SECRET_KEY, PYTHONUNBUFFERED",no,https://github.com/ThreatFlux/YaraFlux,https://github.com/ThreatFlux/YaraFlux
YouTube MCP Server,youtube,youtube-mcp,docker,OSINT Tool,mcp_server,yes,COPY_DOCKER_CONFIG,https://github.com/ZubeidHendricks/youtube-mcp-server,OSS,"A Model Context Protocol (MCP) server implementation for YouTube, enabling AI language models to interact with YouTube content through a standardized interface. A standardized interface for managing a",,no,https://github.com/ZubeidHendricks/youtube-mcp-server,https://github.com/ZubeidHendricks/youtube-mcp-server
YouTube Transcripts MCP Server,youtube_transcript,youtube-transcript-mcp,docker,OSINT Tool,mcp_server,yes,COPY_DOCKER_CONFIG,https://hub.docker.com/u/mcp,OSS,Retrieves transcripts for given YouTube video URLs. A specialized utility for unlocking the knowledge contained within YouTube videos. These servers (like jkawamoto/mcp-youtube-transcript) fetch subti,,no,https://github.com/jkawamoto/mcp-youtube-transcript,https://github.com/jkawamoto/mcp-youtube-transcript
Zscaler MCP Server,zscaler-mcp-server,zscaler-mcp-server-mcp,docker,CASB,mcp_server,yes,COPY_DOCKER_CONFIG,Zscaler,OSS,"The Zscaler MCP Server brings comprehensive Zscaler management capabilities directly to your AI agents and automation workflows. This comprehensive MCP server provides secure, programmatic access to Z",,no,https://github.com/zscaler/zscaler-mcp-server,https://github.com/zscaler/zscaler-mcp-server
AbuseIPDB MCP Server,abuseipdb,abuseipdb-mcp,uvx,MCP Server,mcp_server,yes,REFACTOR_TO_DOCKER,AbuseIPDB,OSS,MCP server wrapper for AbuseIPDB IP reputation checks and abuse report management. Provides tools like check/report/blacklist via stdio MCP for agent workflows and enrichment pipelines.  An implementa,ABUSEIPDB_API_KEY,no,https://www.abuseipdb.com/,https://docs.abuseipdb.com/
